all_awardings,associated_award,author,author_flair_background_color,author_flair_css_class,author_flair_richtext,author_flair_template_id,author_flair_text,author_flair_text_color,author_flair_type,author_fullname,author_patreon_flair,author_premium,awarders,body,collapsed_because_crowd_control,comment_type,created_utc,gildings,id,is_submitter,link_id,locked,no_follow,parent_id,permalink,retrieved_on,score,send_replies,stickied,subreddit,subreddit_id,top_awarded_type,total_awards_received,treatment_tags,author_cakeday,distinguished
[],,usrevenge,,,[],,,,text,t2_921wq,False,False,[],"Multiple universes for a series is stupid.

They can explain away the entirety of the sequel trilogy by it being not only a short time but claiming only a few major planets actually join the new republic.

We learn in aftermath the new republic doesn't control nearly as much as was expected and even coroscant in the canon lore is still under empire control and doesn't look like it changes even during rise of skywalker.

It's basically chandrilla, mon calamari and a few other planets are the new republic.

We could also say the new republic fell apart after the first attack by the order.

So at the end of rise of skywalker we could literally have warlords and small factions instead of a unified republic
 It's basically an open book",,,1609604613,{},ghu5n63,False,t3_kozlhv,False,True,t1_ghu235x,/r/StarWars/comments/kozlhv/the_mandalorian_has_made_me_appreciate_tlj_more/ghu5n63/,1609604663,1,True,False,StarWars,t5_2qi4s,,0,[],,
[],,[deleted],,,,,,dark,,,,,[],[removed],,,1609604609,{},ghu5mv5,False,t3_koh4yi,False,True,t3_koh4yi,/r/StarWars/comments/koh4yi/this_is_an_exceptional_explanation_for_that_one/ghu5mv5/,1609604658,1,True,False,StarWars,t5_2qi4s,,0,[],,
[],,GamingWithJayYT,,,[],,,,text,t2_wy6dsup,False,False,[],"I follow this guy, he is OP. If you look at his account he has a bunch of other ones",,,1609604607,{},ghu5mqc,False,t3_kom0nz,False,True,t1_ghsvnog,/r/StarWars/comments/kom0nz/i_like_to_photoshop_old_paintings_this_is_my_sith/ghu5mqc/,1609604656,1,True,False,StarWars,t5_2qi4s,,0,[],,
[],,thelegoroom,,,[],,,,text,t2_1nzjlvp8,False,False,[],"Yes, good point. I always wondered if palpatine was somehow masking the true depths of it from them somehow, stopping them from seeing what it meant. But IDK - it is something that needs to be addressed I think.",,,1609604567,{},ghu5k4q,True,t3_koxava,False,True,t1_ghu5a0n,/r/StarWars/comments/koxava/over_christmas_i_made_this_lego_scene_showing/ghu5k4q/,1609604607,1,True,False,StarWars,t5_2qi4s,,0,[],,
[],,Frescopino,,,[],,,,text,t2_x52xh,False,False,[],"Wouldn't it be unwise to do so? Wouldn't you leave your head exposed by sliding your blade, your only line of defense, down to their fingers?",,,1609604563,{},ghu5jx5,False,t3_koh4yi,False,True,t1_ghu0i8e,/r/StarWars/comments/koh4yi/this_is_an_exceptional_explanation_for_that_one/ghu5jx5/,1609604603,1,True,False,StarWars,t5_2qi4s,,0,[],,
[],,GamingWithJayYT,,,[],,,,text,t2_wy6dsup,False,False,[],Am I missing something? Is Malak hiding somewhere?,,,1609604535,{},ghu5i11,False,t3_kom0nz,False,True,t1_ghu4vd5,/r/StarWars/comments/kom0nz/i_like_to_photoshop_old_paintings_this_is_my_sith/ghu5i11/,1609604573,1,True,False,StarWars,t5_2qi4s,,0,[],,
[],,CT24601,,,[],,,,text,t2_88wm7ii3,False,False,[],"Everything’s flawed, but again, I’m wondering what you’re trying to do. It seems like you’re describing New Hope in the least flattering way possible in order to suggest we shouldn’t criticise the other films if they don’t live up to the same standard.

And I know you had a honey tone but you also made a serious point, I’m responding to the serious point. And I think it’s deeply flawed.",,,1609604525,{},ghu5hcf,False,t3_kozz8n,False,True,t1_ghu4vmh,/r/StarWars/comments/kozz8n/lets_talk_about_luke_skywalker_for_a_second/ghu5hcf/,1609604562,1,True,False,StarWars,t5_2qi4s,,0,[],,
[],,fornynseven,,,[],,,,text,t2_5okna69g,False,False,[],"I see, so what's the difference between a normal novel, junior novel and a young-readers novel? Are they suppose to highlight the age demographic or it's more of a type of novel? And do you think i should buy all 3 books or just 1 or 2?",,,1609604516,{},ghu5gqf,True,t3_kp039d,False,True,t1_ghu4t6p,/r/StarWars/comments/kp039d/high_republic_books/ghu5gqf/,1609604553,1,True,False,StarWars,t5_2qi4s,,0,[],,
[],,Yrguiltyconscience,,,[],,,,text,t2_2zulofl,False,False,[],"He’s a good kid who was the product of his environment.

Started life as a slave and the religious cult who was supposed to take care of him, used him as a weapon in a pointless war.


He was made a “general” with all the responsibilities and heavy decisions at an age where most kids are still in college.


How does a fundamentally good person help build a Death Star? Ask the people who taught him it was alright to grow human beings to be used for cannon fodder.


And it’s just a movie. We can cheer for and like characters regardless. It’s not like Anakin actually killed a real human being.",,,1609604510,{},ghu5ga6,False,t3_kodzbd,False,True,t1_ghu3x2g,/r/StarWars/comments/kodzbd/anakin_skywalker_why_do_people_defend_this/ghu5ga6/,1609604545,1,True,False,StarWars,t5_2qi4s,,0,[],,
[],,Responsible-Bat658,,,[],,,,text,t2_8dt3gus7,False,False,[],That’s just not true at all. The men who made the return of Luke absolutely did not enjoy how Luke was handled in TLJ. It’s simply isn’t possible,,,1609604505,{},ghu5fyl,False,t3_kozlhv,False,True,t1_ghu3sz7,/r/StarWars/comments/kozlhv/the_mandalorian_has_made_me_appreciate_tlj_more/ghu5fyl/,1609604540,1,True,False,StarWars,t5_2qi4s,,0,[],,
[],,traceitalian,,,[],,,,text,t2_nsc6b,False,False,[],"Yeah, the score is consistently great. Everything else is just an utter mess, I don't blame any of the actors either to be honest. The script, direction and lack of an environment to give context and mise en scene to sequences is clear in each of the films.",,,1609604503,{},ghu5fua,False,t3_koh4yi,False,True,t1_ghu4pgl,/r/StarWars/comments/koh4yi/this_is_an_exceptional_explanation_for_that_one/ghu5fua/,1609604538,1,True,False,StarWars,t5_2qi4s,,0,[],,
[],,Worried_Thylacine,,,[],,,,text,t2_8z4guhpb,False,False,[],If they thought tracking through hyperspace wasn’t possible then how did they know exactly where the hyperspace tracker was on the ship?  Like they ever had schematics.,,,1609604484,{},ghu5ek8,False,t3_kokbqc,False,False,t1_ghsua8t,/r/StarWars/comments/kokbqc/saoirse_ronan_as_a_young_vice_admiral_amilyn_holdo/ghu5ek8/,1609604517,1,True,False,StarWars,t5_2qi4s,,0,[],,
[],,St3v3z,,,[],,,,text,t2_4buiecih,False,False,[],"I knew you would say that you only ever spoke to me directly.

""Everyone in this sub is so dumb on every TLJ topic""

You said this before I clicked on this thread... 

TROS and TLJ are poor films, but TROS was fucked from the start because it had to pick up the shattered pieces TLJ left it with. It did the best it could, but it was always doomed. TLJ was shit despite having loads of potential to play with. That's the difference. 

Ps: I don't care if you respect me or my opinion. Your anonymous insults me nothing to anyone, keep them to yourself.",,,1609604476,{},ghu5e2s,False,t3_kokbqc,False,True,t1_ghu4p9j,/r/StarWars/comments/kokbqc/saoirse_ronan_as_a_young_vice_admiral_amilyn_holdo/ghu5e2s/,1609604509,1,True,False,StarWars,t5_2qi4s,,0,[],,
[],,ReProps,,,[],,,,text,t2_836s0l5a,False,True,[],"Here’s a post I made around Halloween of it, https://www.reddit.com/r/somethingimade/comments/jfz7tq/made_a_darth_vader_costume_from_cardboard/",,,1609604471,{},ghu5dq1,True,t3_kood2g,False,True,t1_ghu4vqo,/r/StarWars/comments/kood2g/all_my_helmets_so_farall_of_them_are_made_from/ghu5dq1/,1609604503,1,True,False,StarWars,t5_2qi4s,,0,[],,
[],,[deleted],,,,,,dark,,,,,[],[removed],,,1609604447,{},ghu5c66,False,t3_kozz6e,False,True,t3_kozz6e,/r/StarWars/comments/kozz6e/my_own_jedi/ghu5c66/,1609604480,1,True,False,StarWars,t5_2qi4s,,0,[],,
[],,snuskesif,,,[],,,,text,t2_1pkk93nf,False,False,[],damn i just gave away my silver award,,,1609604445,{},ghu5c2j,False,t3_koxava,False,True,t3_koxava,/r/StarWars/comments/koxava/over_christmas_i_made_this_lego_scene_showing/ghu5c2j/,1609604478,1,True,False,StarWars,t5_2qi4s,,0,[],,
[],,Kyber99,,7-4 bigFlair,[],93e1774a-77f2-11e9-87c5-0e6b5ac6d1ea,Savage Opress,dark,text,t2_egd1qyv,False,False,[],"Knights of Ren would be sick honestly, like a backstory for them and Ren himself",,,1609604444,{},ghu5bxo,False,t3_kophgw,False,True,t3_kophgw,/r/StarWars/comments/kophgw/some_shows_that_should_exits_made_these_a_few/ghu5bxo/,1609604476,1,True,False,StarWars,t5_2qi4s,,0,[],,
[],,sotommy,,,[],,,,text,t2_16662r,False,False,[],Let them cry,,,1609604423,{},ghu5alk,False,t3_kokbqc,False,True,t1_ghsmpvd,/r/StarWars/comments/kokbqc/saoirse_ronan_as_a_young_vice_admiral_amilyn_holdo/ghu5alk/,1609604456,1,True,False,StarWars,t5_2qi4s,,0,[],,
[],,Swankified_Tristan,,35,[],,,dark,text,t2_ehlj9,False,True,[],"My friend thinks Boba led the attack on the farm.  

Vader tells him, ""no disintegrations!"" And this is the only scene that we actually see a disintegration.",,,1609604414,{},ghu5a1e,True,t3_kozz8n,False,True,t1_ghu4h86,/r/StarWars/comments/kozz8n/lets_talk_about_luke_skywalker_for_a_second/ghu5a1e/,1609604447,1,True,False,StarWars,t5_2qi4s,,0,[],,
[],,bhldev,,,[],,,,text,t2_dcjll,False,False,[],"Actually Anakin killed a lot of innocent people (Tuskens) early on in their houses

Jedi Council and Obi Wan completely failed to see the dark side in that... and Padme was told too and did nothing. Huge plot failure",,,1609604414,{},ghu5a0n,False,t3_koxava,False,True,t1_ghu4zlp,/r/StarWars/comments/koxava/over_christmas_i_made_this_lego_scene_showing/ghu5a0n/,1609604446,1,True,False,StarWars,t5_2qi4s,,0,[],,
[],,HolocronSurvivor,,,[],,,,text,t2_2sxyl5xj,False,False,[],"No problemo, thanks for the cool wallpaper",,,1609604394,{},ghu58mr,True,t3_kozogu,False,True,t1_ghu2u8d,/r/StarWars/comments/kozogu/credit_to_uobiwan_kenobi_for_the_vader_image/ghu58mr/,1609604423,1,True,False,StarWars,t5_2qi4s,,0,[],,
[],,thelegoroom,,,[],,,,text,t2_1nzjlvp8,False,False,[],"Cool, I didn’t know that 👍",,,1609604356,{},ghu565y,True,t3_koxava,False,True,t1_ghu50cp,/r/StarWars/comments/koxava/over_christmas_i_made_this_lego_scene_showing/ghu565y/,1609604384,1,True,False,StarWars,t5_2qi4s,,0,[],,
[],,[deleted],,,,,,dark,,,,,[],[removed],,,1609604351,{},ghu55sg,False,t3_kozz6e,False,True,t3_kozz6e,/r/StarWars/comments/kozz6e/my_own_jedi/ghu55sg/,1609604379,1,True,False,StarWars,t5_2qi4s,,0,[],,
[],,Kyber99,,7-4 bigFlair,[],93e1774a-77f2-11e9-87c5-0e6b5ac6d1ea,Savage Opress,dark,text,t2_egd1qyv,False,False,[],"Glad you enjoyed them, welcome to the fandom! For me it’s (my opinion changes often tho honestly):

3, 4, R1, 5, 6, 2, Solo, 1, 9, 8, 7",,,1609604338,{},ghu54xd,False,t3_kopnjr,False,True,t3_kopnjr,/r/StarWars/comments/kopnjr/just_finished_all_films_for_the_first_time/ghu54xd/,1609604366,1,True,False,StarWars,t5_2qi4s,,0,[],,
[],,thelegoroom,,,[],,,,text,t2_1nzjlvp8,False,False,[],"Thanks for the awesome comment Dude, I appreciate it. And never stop collecting 👍",,,1609604318,{},ghu53nb,True,t3_koxava,False,True,t1_ghu4yrn,/r/StarWars/comments/koxava/over_christmas_i_made_this_lego_scene_showing/ghu53nb/,1609604347,1,True,False,StarWars,t5_2qi4s,,0,[],,
[],,stirredturd,,,[],,,,text,t2_123wow,False,False,[],Haha it's what Marvel has printed on the cover.,,,1609604315,{},ghu53gp,True,t3_kowthk,False,True,t1_ghu3hmj,/r/StarWars/comments/kowthk/chewie_and_threepio/ghu53gp/,1609604344,1,True,False,StarWars,t5_2qi4s,,0,[],,
[],,MrRasmiros,,,[],,,,text,t2_c9r4rce,False,False,[],Wishes these movies will go away .,,,1609604299,{},ghu52fy,False,t3_kozyqk,False,True,t3_kozyqk,/r/StarWars/comments/kozyqk/reys_lineage_explained_with_no_bs/ghu52fy/,1609604327,1,True,False,StarWars,t5_2qi4s,,0,[],,
[],,TLM86,,1-3 bigFlair,[],e936c4d4-77ed-11e9-ad90-0ec1639f6d96,Jedi,dark,text,t2_98lb6,False,False,[],Midi-chlorian. It doesn't mean a great deal to the prophecy itself; the fact he was apparently born of the Force is more relevant. But neither of them mean the prophecy had to pan out as the Jedi expected.,,,1609604299,{},ghu52dz,False,t3_kozh7k,False,True,t1_ghu44zb,/r/StarWars/comments/kozh7k/how_do_you_reconcile_the_chosen_one_prophecy_with/ghu52dz/,1609604327,1,True,False,StarWars,t5_2qi4s,,0,[],,
[],,chunkymonkey922,,,[],,,,text,t2_10pnl8,False,False,[],Haha yeah I can’t convince my wife either. Maybe my 5 year old can convince her!,,,1609604282,{},ghu519e,True,t3_koxv89,False,True,t1_ghu4up5,/r/StarWars/comments/koxv89/really_impressed_with_the_sith_lego_art_set_now/ghu519e/,1609604309,1,True,False,StarWars,t5_2qi4s,,0,[],,
[],,Mucekalonso,,,[],,,,text,t2_1iahelm8,False,False,[],This looks amazing,,,1609604276,{},ghu50w0,False,t3_koxava,False,True,t3_koxava,/r/StarWars/comments/koxava/over_christmas_i_made_this_lego_scene_showing/ghu50w0/,1609604303,1,True,False,StarWars,t5_2qi4s,,0,[],,
[],,chippy-triforce,,,[],,,,text,t2_63fopm7z,False,False,[],Yeah they do they ask you if it’s to any existing licensed series just to clarify if they need to buy licensing or not,,,1609604268,{},ghu50cp,False,t3_koxava,False,True,t1_ghu4umu,/r/StarWars/comments/koxava/over_christmas_i_made_this_lego_scene_showing/ghu50cp/,1609604296,1,True,False,StarWars,t5_2qi4s,,0,[],,
[],,ReProps,,,[],,,,text,t2_836s0l5a,False,True,[],"I’m planning on it, have one for the blue mando but just finished making the boba fett ones and Veteran Ranger a couple days ago",,,1609604265,{},ghu505o,True,t3_kood2g,False,True,t1_ghtqp5c,/r/StarWars/comments/kood2g/all_my_helmets_so_farall_of_them_are_made_from/ghu505o/,1609604292,1,True,False,StarWars,t5_2qi4s,,0,[],,
[],,thelegoroom,,,[],,,,text,t2_1nzjlvp8,False,False,[],I know! A few folks have said the same. But I have the temple March which happens just before and it wouldn’t feel right building a scene with dead kids 😲👍,,,1609604257,{},ghu4zlp,True,t3_koxava,False,True,t1_ghu4u3b,/r/StarWars/comments/koxava/over_christmas_i_made_this_lego_scene_showing/ghu4zlp/,1609604284,1,True,False,StarWars,t5_2qi4s,,0,[],,
[],,ArGarBarGar,,,[],,,,text,t2_jc1md,False,False,[],"You remember why the FO was able to discover their ships in the first place, right?",,,1609604257,{},ghu4zl3,False,t3_kokbqc,False,True,t1_ghswiwk,/r/StarWars/comments/kokbqc/saoirse_ronan_as_a_young_vice_admiral_amilyn_holdo/ghu4zl3/,1609604284,1,True,False,StarWars,t5_2qi4s,,0,[],,
[],,Jmomo69,,,[],,,,text,t2_kcn7y,False,False,[],Head canon....I like that,,,1609604253,{},ghu4za2,False,t3_kop772,False,True,t1_ghtkct8,/r/StarWars/comments/kop772/anakin_unknowingly_imitates_darth_mauls_enraged/ghu4za2/,1609604279,1,True,False,StarWars,t5_2qi4s,,0,[],,
[],,[deleted],,,,,,dark,,,,,[],[removed],,,1609604251,{},ghu4z6x,False,t3_kohtgf,False,True,t3_kohtgf,/r/StarWars/comments/kohtgf/time_for_a_new_start/ghu4z6x/,1609604278,1,True,False,StarWars,t5_2qi4s,,0,[],,
[],,Jango313,,2-1 bigFlair,[],625e69e8-77ee-11e9-af39-0eef782999c6,Anakin Skywalker,dark,text,t2_tt72v,False,False,[],This is one of the most beautiful things I've layed my eyes upon. I've been collecting Star Wars LEGO since I was very young toddler in 1999 and RoTS is my favorite film - this ties those two together perfectly. I need to get to work! Bravo!,,,1609604245,{},ghu4yrn,False,t3_koxava,False,True,t3_koxava,/r/StarWars/comments/koxava/over_christmas_i_made_this_lego_scene_showing/ghu4yrn/,1609604272,1,True,False,StarWars,t5_2qi4s,,0,[],,
[],,jdeja4,,,[],,,,text,t2_1650ury8,False,False,[],"Just take my upvote man, stunning work",,,1609604235,{},ghu4y3c,False,t3_koxava,False,True,t3_koxava,/r/StarWars/comments/koxava/over_christmas_i_made_this_lego_scene_showing/ghu4y3c/,1609604262,1,True,False,StarWars,t5_2qi4s,,0,[],,
[],,Responsible-Bat658,,,[],,,,text,t2_8dt3gus7,False,False,[],"Yep, sad.",,,1609604214,{},ghu4wr7,False,t3_kozz8n,False,True,t1_ghu4efk,/r/StarWars/comments/kozz8n/lets_talk_about_luke_skywalker_for_a_second/ghu4wr7/,1609604240,1,True,False,StarWars,t5_2qi4s,,0,[],,
[],,somedudeidkk8108,,,[],,,,text,t2_91c130mh,False,False,[],What’s wrong with a kids show? Anyone can be a kid 😉,,,1609604207,{},ghu4w8j,False,t3_kox6fm,False,True,t3_kox6fm,/r/StarWars/comments/kox6fm/in_my_opinion_twilight_of_the_apprentice_was_some/ghu4w8j/,1609604231,1,True,False,StarWars,t5_2qi4s,,0,[],,
[],,Dependent-Hornet-833,,,[],,,,text,t2_94czuqmo,False,False,[],Oh ok sorry for being very hard on me down voting but I understand hope the Vader mask will look good when u do it,,,1609604199,{},ghu4vqo,False,t3_kood2g,False,True,t1_ghtp49z,/r/StarWars/comments/kood2g/all_my_helmets_so_farall_of_them_are_made_from/ghu4vqo/,1609604223,1,True,False,StarWars,t5_2qi4s,,0,[],,
[],,Swankified_Tristan,,35,[],,,dark,text,t2_ehlj9,False,True,[],"Oh grow up. 

Star Wars is still a good film and it's still extremely silly. This was just me poking fun at what I love and understanding that it's been ridiculous and inconsistent from the start. 

But you're already here to jump on the hate bandwagon and take things to a serious level on a post that is anything but serious. 

Have fun. Laugh.  Understand that Star Wars is and always has been flawed.  You'll enjoy it a lot more. I promise.",,,1609604197,{},ghu4vmh,True,t3_kozz8n,False,True,t1_ghu4efk,/r/StarWars/comments/kozz8n/lets_talk_about_luke_skywalker_for_a_second/ghu4vmh/,1609604220,1,True,False,StarWars,t5_2qi4s,,0,[],,
[],,RemarkableLime91,,,[],,,,text,t2_66ui4md2,False,False,[],I like how Malak looks a bit mournful or wistful. But Malgus is head on looking for who Dares Oppose Him,,,1609604193,{},ghu4vd5,False,t3_kom0nz,False,True,t1_ghsxwpn,/r/StarWars/comments/kom0nz/i_like_to_photoshop_old_paintings_this_is_my_sith/ghu4vd5/,1609604217,1,True,False,StarWars,t5_2qi4s,,0,[],,
[],,phekno,,,[],,,,text,t2_e60hh,False,False,[],Lol...I had the same thought.  It took me years to convince my wife that I HAD to get the Millennium Falcon set...IDK if I’ll have the same success convincing her that I need 6 of these...,,,1609604184,{},ghu4up5,False,t3_koxv89,False,True,t1_ghu4o3v,/r/StarWars/comments/koxv89/really_impressed_with_the_sith_lego_art_set_now/ghu4up5/,1609604207,1,True,False,StarWars,t5_2qi4s,,0,[],,
[],,thelegoroom,,,[],,,,text,t2_1nzjlvp8,False,False,[],Thanks. Pretty sure they don’t take Star Wars submissions but appreciate the thought 👍,,,1609604183,{},ghu4umu,True,t3_koxava,False,True,t1_ghu4kwz,/r/StarWars/comments/koxava/over_christmas_i_made_this_lego_scene_showing/ghu4umu/,1609604206,1,True,False,StarWars,t5_2qi4s,,0,[],,
[],,kenny7337,,,[],,,,text,t2_bhatz,False,True,[],Thanks for the recipe. I'll have to give a go for sure!,,,1609604181,{},ghu4uhy,False,t3_koy8fy,False,True,t1_ghtvl1f,/r/StarWars/comments/koy8fy/first_attempt_at_baby_yoda_macarons_and_my_first/ghu4uhy/,1609604204,1,True,False,StarWars,t5_2qi4s,,0,[],,
[],,SisterAndromeda2007,#edeff1,3-1 bigFlair,[],e112365c-77ee-11e9-96d5-0e02fa4e8f0a,Luke Skywalker,dark,text,t2_3boc681z,False,False,[],Whatever dude,,,1609604180,{},ghu4ufm,True,t3_kozrkx,False,True,t1_ghu4s93,/r/StarWars/comments/kozrkx/sharing_my_collection_i_had_more/ghu4ufm/,1609604203,1,True,False,StarWars,t5_2qi4s,,0,[],,
[],,xiamandrewx,,,[],,,,text,t2_l5v0z8j,False,False,[],"It's cool, I'm just pulling your leg.",,,1609604179,{},ghu4udw,False,t3_koxpsw,False,True,t1_ghu290h,/r/StarWars/comments/koxpsw/legacy_clones_and_a_true_ending_do_it/ghu4udw/,1609604203,1,True,False,StarWars,t5_2qi4s,,0,[],,
[],,Leashii_,,4-5 bigFlair,[],e6843eae-77ef-11e9-b717-0eea20f18e98,Rey,dark,text,t2_4y9gwdqr,False,False,[],it made more money than the prequels tho,,,1609604174,{},ghu4u3l,False,t3_kozh7k,False,True,t1_ghu2con,/r/StarWars/comments/kozh7k/how_do_you_reconcile_the_chosen_one_prophecy_with/ghu4u3l/,1609604198,1,True,False,StarWars,t5_2qi4s,,0,[],,
[],,bhldev,,,[],,,,text,t2_dcjll,False,False,[],"Good job

BUT

Missing the child killing : )",,,1609604174,{},ghu4u3b,False,t3_koxava,False,True,t3_koxava,/r/StarWars/comments/koxava/over_christmas_i_made_this_lego_scene_showing/ghu4u3b/,1609604198,1,True,False,StarWars,t5_2qi4s,,0,[],,
[],,TLM86,,1-3 bigFlair,[],e936c4d4-77ed-11e9-ad90-0ec1639f6d96,Jedi,dark,text,t2_98lb6,False,False,[],"*A Test of Courage* is a junior novel, and *Into the Dark* is young-readers. They're all part of the same overall storyline that *Light of the Jedi* is also part of.

I'd also point out that the young-reader books are among the best works in Star Wars canon so far, especially Claudia Gray's previous stories like *Lost Stars*. It shouldn't be equated to a lack of quality.",,,1609604160,{},ghu4t6p,False,t3_kp039d,False,True,t3_kp039d,/r/StarWars/comments/kp039d/high_republic_books/ghu4t6p/,1609604183,1,True,False,StarWars,t5_2qi4s,,0,[],,
[],,kenny7337,,,[],,,,text,t2_bhatz,False,True,[],"Haha, not a bad thing to dream about lol. I like the ways the ears came out. It's a great idea. They're very cute. I may have to try my hand as well.",,,1609604148,{},ghu4sf7,False,t3_koy8fy,False,True,t1_ghtup7d,/r/StarWars/comments/koy8fy/first_attempt_at_baby_yoda_macarons_and_my_first/ghu4sf7/,1609604171,1,True,False,StarWars,t5_2qi4s,,0,[],,
[],,Sugbert,,,[],,,,text,t2_46i43a6z,False,False,[],"sorry, bet they got good grip",,,1609604145,{},ghu4s93,False,t3_kozrkx,False,True,t1_ghu4m3w,/r/StarWars/comments/kozrkx/sharing_my_collection_i_had_more/ghu4s93/,1609604169,1,True,False,StarWars,t5_2qi4s,,0,[],,
[],,ReProps,,,[],,,,text,t2_836s0l5a,False,True,[],Thanks!,,,1609604140,{},ghu4rvd,True,t3_kood2g,False,True,t1_ghtvhou,/r/StarWars/comments/kood2g/all_my_helmets_so_farall_of_them_are_made_from/ghu4rvd/,1609604163,1,True,False,StarWars,t5_2qi4s,,0,[],,
[],,RoyTheReaper91,#edeff1,3-1 bigFlair,[],e112365c-77ee-11e9-96d5-0e02fa4e8f0a,Luke Skywalker,dark,text,t2_29i1l10b,False,False,[],The fucking mental gymnastics prequel fans go to in order to defend this is astounding.,,,1609604127,{},ghu4qxe,False,t3_koh4yi,False,True,t3_koh4yi,/r/StarWars/comments/koh4yi/this_is_an_exceptional_explanation_for_that_one/ghu4qxe/,1609604148,1,True,False,StarWars,t5_2qi4s,,0,[],,
[],,thelegoroom,,,[],,,,text,t2_1nzjlvp8,False,False,[],Freedom of art it is!,,,1609604126,{},ghu4qv1,True,t3_koxava,False,True,t1_ghu4lku,/r/StarWars/comments/koxava/over_christmas_i_made_this_lego_scene_showing/ghu4qv1/,1609604147,1,True,False,StarWars,t5_2qi4s,,0,[],,
[],,Noob_Helper01,,,[],,,,text,t2_5dx1ynlu,False,False,[],They're robotic,,,1609604110,{},ghu4pu7,False,t3_koyxzt,False,True,t1_ghu3qgk,/r/StarWars/comments/koyxzt/with_so_many_people_sharing_their_beautiful/ghu4pu7/,1609604131,1,True,False,StarWars,t5_2qi4s,,0,[],,
[],,Holociraptor,,,[],,,,text,t2_121xba,False,False,[],The score is the one thing about the prequels that I can say I'm definitely a fan of. But it's the only thing holding the rest together.,,,1609604104,{},ghu4pgl,False,t3_koh4yi,False,True,t1_ghu4gt1,/r/StarWars/comments/koh4yi/this_is_an_exceptional_explanation_for_that_one/ghu4pgl/,1609604125,1,True,False,StarWars,t5_2qi4s,,0,[],,
[],,t0m0hawk,,,[],,,,text,t2_5ubig,False,False,[],3P0,,,1609604101,{},ghu4pa0,False,t3_kowthk,False,True,t1_ghu3hmj,/r/StarWars/comments/kowthk/chewie_and_threepio/ghu4pa0/,1609604122,1,True,False,StarWars,t5_2qi4s,,0,[],,
[],,TakeTheQuickTwo,,,[],,,,text,t2_3mkqd3wt,False,False,[],"No, I’ve only talked to you directly, not everyone who doesn’t like the movie. 

“The logic of Star Wars so far” is code for “the same exact story told again”.

And if you earnestly think TROS is better than TLJ, I have even less respect for your opinion",,,1609604101,{},ghu4p9j,False,t3_kokbqc,False,True,t1_ghu4ca9,/r/StarWars/comments/kokbqc/saoirse_ronan_as_a_young_vice_admiral_amilyn_holdo/ghu4p9j/,1609604122,1,True,False,StarWars,t5_2qi4s,,0,[],,
[],,chunkymonkey922,,,[],,,,text,t2_10pnl8,False,False,[],The ultimate one is my goal too! If I had a lot of money I’d get 6 sets so I could do all 3 and the ultimate haha,,,1609604083,{},ghu4o3v,True,t3_koxv89,False,True,t1_ghu46xu,/r/StarWars/comments/koxv89/really_impressed_with_the_sith_lego_art_set_now/ghu4o3v/,1609604104,1,True,False,StarWars,t5_2qi4s,,0,[],,
[],,Leon-95,,,[],,,,text,t2_65sjr9oj,False,False,[],"me: 2021 is going to be great

AT-AT has entered the chat",,,1609604065,{},ghu4mx2,False,t3_koejb5,False,True,t3_koejb5,/r/StarWars/comments/koejb5/2021_is_off_to_an_interesting_start/ghu4mx2/,1609604087,1,True,False,StarWars,t5_2qi4s,,0,[],,
[],,elijahsee2018,,,[],,,,text,t2_65qybeio,False,False,[],"No, see there is definitely more good than bad in the sequel trilogy. Finn and Rose were not done well and i don't enjoy them through out the films... But now we have badasses like po and kylo renn, and then people say rey is a mary sue but is she really? Constantly struggling with where she comes from and finally gets the heartbreaking truth. Her story arc isn't as much as becoming a jedi, its more about finding herself and her place in the galaxy, which happens to be as a jedi... And cmon, palatines return... Proving that he knew the secret of how to cheat death. And is still in the process of perfecting it, like snoke who was palatine all along. Like come on how can you say that that isn't epic.",,,1609604055,{},ghu4mbe,False,t3_kozlhv,False,True,t1_ghu235x,/r/StarWars/comments/kozlhv/the_mandalorian_has_made_me_appreciate_tlj_more/ghu4mbe/,1609604078,1,True,False,StarWars,t5_2qi4s,,0,[],,
[],,MAlHuq,,,[],,,,text,t2_3rb514gr,False,False,[],"Really nice, well done 
Any chance of you uploading the images  in the highest quality so I can use it as a wallpaper?
Thanks",,,1609604054,{},ghu4m8r,False,t3_kovrcn,False,True,t3_kovrcn,/r/StarWars/comments/kovrcn/i_had_made_these_during_christmas_holidays_hope/ghu4m8r/,1609604076,1,True,False,StarWars,t5_2qi4s,,0,[],,
