all_awardings,associated_award,author,author_flair_background_color,author_flair_css_class,author_flair_richtext,author_flair_template_id,author_flair_text,author_flair_text_color,author_flair_type,author_fullname,author_patreon_flair,author_premium,awarders,body,collapsed_because_crowd_control,comment_type,created_utc,gildings,id,is_submitter,link_id,locked,no_follow,parent_id,permalink,retrieved_on,score,send_replies,stickied,subreddit,subreddit_id,top_awarded_type,total_awards_received,treatment_tags,author_cakeday,distinguished
[],,ToxicityIncarnate,,,[],,,,text,t2_17218zw2,False,False,[],Pretty sure none of that is real.,,,1609616708,{},ghut7lc,False,t3_koxava,False,True,t1_ghuqsyg,/r/StarWars/comments/koxava/over_christmas_i_made_this_lego_scene_showing/ghut7lc/,1609618066,2,True,False,StarWars,t5_2qi4s,,0,[],,
[],,dlandis07,#edeff1,3-1 bigFlair,[],e112365c-77ee-11e9-96d5-0e02fa4e8f0a,Luke Skywalker,dark,text,t2_3h5062yx,False,False,[],A bold one you are. May I ask why?,,,1609616702,{},ghut74p,True,t3_kp3rjn,False,True,t1_ghut2yh,/r/StarWars/comments/kp3rjn/lets_talk_send_me_some_of_your_hot_takes_or/ghut74p/,1609618059,1,True,False,StarWars,t5_2qi4s,,0,[],,
[],,Skyguy_2020,,2-4 bigFlair,[],6fd2c312-77ee-11e9-9eab-0ef350b1bb88,Obi-Wan Kenobi,dark,text,t2_5b4put9k,False,False,[],I actually like the sequel trilogy better than the prequel trilogy.,,,1609616644,{},ghut2yh,False,t3_kp3rjn,False,True,t3_kp3rjn,/r/StarWars/comments/kp3rjn/lets_talk_send_me_some_of_your_hot_takes_or/ghut2yh/,1609617994,1,True,False,StarWars,t5_2qi4s,,0,[],,
[],,MalakaiRey,,,[],,,,text,t2_lae4k,False,False,[],How much would you compare light saber duels to fencing?,,,1609616621,{},ghut1au,False,t3_koh4yi,False,True,t1_ghufy4d,/r/StarWars/comments/koh4yi/this_is_an_exceptional_explanation_for_that_one/ghut1au/,1609617965,1,True,False,StarWars,t5_2qi4s,,0,[],,
[],,ilovedoors8811,,,[],,,,text,t2_4zfbtpv7,False,False,[],Funny enough ROTS is my favourite film,,,1609616600,{},ghuszs0,False,t3_koxhev,False,True,t1_ghuicos,/r/StarWars/comments/koxhev/another_sebulba_sighting_from_my_building_at_work/ghuszs0/,1609617941,1,True,False,StarWars,t5_2qi4s,,0,[],,
[],,Xunaun,,,[],,,,text,t2_83e79s8x,False,False,[],"""It shall be done, My Lord...""",,,1609616565,{},ghusxau,False,t3_kp239j,False,True,t3_kp239j,/r/StarWars/comments/kp239j/my_dad_just_sent_me_this/ghusxau/,1609617903,1,True,False,StarWars,t5_2qi4s,,0,[],,
[],,WatchBat,,2-6 bigFlair,[],76eab074-77ee-11e9-a80e-0ec377e51954,Sith Anakin,dark,text,t2_4uipmj27,False,False,[],"Yeah, I guess it's simply a matter of our interpretation of that scene.",,,1609616545,{},ghusvxr,False,t3_kp36tq,False,True,t1_ghusp90,/r/StarWars/comments/kp36tq/the_kenobi_show_and_continuity/ghusvxr/,1609617883,2,True,False,StarWars,t5_2qi4s,,0,[],,
[],,Tubesock1202,,,[],,,,text,t2_vlhe3,False,False,[],"What happens when god falls over? *Can* god fall over? Falling over implies ""failing to stand up"". Can god fail?",,,1609616538,{},ghusvfe,False,t3_kp3yra,False,True,t3_kp3yra,/r/StarWars/comments/kp3yra/what_if_a_gonk_droid_falls_over/ghusvfe/,1609617874,0,True,False,StarWars,t5_2qi4s,,0,[],,
[],,fartmunchersupreme,,,[],,,,text,t2_7u1stcqg,False,False,[],Apparently not. Welcome to the SW fandom,,,1609616497,{},ghussie,False,t3_kp3rb3,False,True,t1_ghur9sy,/r/StarWars/comments/kp3rb3/mandalorian_finale_should_have_introduced_dark/ghussie/,1609617829,2,True,False,StarWars,t5_2qi4s,,0,[],,
[],,sirkaracho,,,[],,,,text,t2_o329j,False,False,[],"It makes logical sense, but only with the explanations. Not showing such important things about charackter development is just bad storytelling. Also from episode 8 onward a major intent wasnt to make a good narrative, but to fuck up everything the movie before it established, especially TLJ following TFA.

If it all makes sense for you this way it is ok. I mean i myself think for example not hinting how batman came back to gotham in DKR is bad too, but i can live with that. In DKR it is just some plot point though, in the sequel triogy it is an important part of the story that has to be interpreted.

My interpretation is that lukes situation in ROTJ was much much worse, and he still came out on top and not stood on the good side himself, but also saved another one and took him back rom the dark side. In the sequel trilogy he should even be stronger in his connection to the light side, but they ignored that just for shock value or whatever, i dont know, they werent interested in making a coherent new trilogy at all.

I can accept flaws like this one if the whole thing would be a well made trilogy, but the only good things are the designs, production values, and some of the actors. So it is more me looking at the sequel trilogy as a pile of crap that is still genunely fun to look at as long as the camera isnt zoomed all the way on reys face showing the same trembling emotion every time (as much emotion as that papercraft of a character can have).

If someone has to explain something like that in a movie that isnt meant to be a thinking mans movie, it just is a flaw. Pretty much every movie has flaws. But the sequel trilogy is almost nothing but flaws only held together by the brand name and amazing adiovisuals.

Maybe i am not the right person to talk to here, because maybe it is more meant to be like ""hey i have an idea how this coud work out"" kinda thread where my response would be more fitting for a ""you all dont realize how good the sequels really are"" thread. So i apologize for that.",,,1609616477,{},ghusr4l,False,t3_kozlhv,False,True,t1_ghupnup,/r/StarWars/comments/kozlhv/the_mandalorian_has_made_me_appreciate_tlj_more/ghusr4l/,1609617806,1,True,False,StarWars,t5_2qi4s,,0,[],,
[],,Sugbert,,,[],,,,text,t2_46i43a6z,False,False,[],Chuckles warmly and playfully as he electrocutes you to death,,,1609616467,{},ghusqey,False,t3_kp3uu0,False,True,t3_kp3uu0,/r/StarWars/comments/kp3uu0/your_pal_friendpatine/ghusqey/,1609617794,1,True,False,StarWars,t5_2qi4s,,0,[],,
[],,TrooperNI,,208,[],784cf146-e8f5-11e6-8fc1-0eb5a66e3f02,,dark,text,t2_1tfu8qus,False,False,[],"A real Star Wars fan would by this, and it keeps you looking cool for owning it.",,,1609616462,{},ghusq3k,True,t3_kp3qkk,False,True,t1_ghusn7z,/r/StarWars/comments/kp3qkk/lets_not_lose_sight_of_what_a_real_true_star_wars/ghusq3k/,1609617790,1,True,False,StarWars,t5_2qi4s,,0,[],,
[],,TLM86,,1-3 bigFlair,[],e936c4d4-77ed-11e9-ad90-0ec1639f6d96,Jedi,dark,text,t2_98lb6,False,False,[],"I don't get that from it, personally. He just seems wistful over hearing the name Obi-Wan.",,,1609616450,{},ghusp90,False,t3_kp36tq,False,True,t1_ghusell,/r/StarWars/comments/kp36tq/the_kenobi_show_and_continuity/ghusp90/,1609617777,2,True,False,StarWars,t5_2qi4s,,0,[],,
[],,mikachu93,,1-3 bigFlair,[],e936c4d4-77ed-11e9-ad90-0ec1639f6d96,Jedi,dark,text,t2_zijhu,False,False,[],I really don't want to see the show revived for a third time. Let it rest. All the stories you name can be told elsewhere.,,,1609616434,{},ghuso5p,False,t3_kp3u4m,False,True,t3_kp3u4m,/r/StarWars/comments/kp3u4m/who_would_want_the_clone_wars_to_have_season_8/ghuso5p/,1609617761,3,True,False,StarWars,t5_2qi4s,,0,[],,
[],,Xunaun,,,[],,,,text,t2_83e79s8x,False,False,[],"Alcohol and drugs are a different argument, because some people are more subject to addiction than others. I drink quite frequently, I am aware of this fact, but it doesn't have a hold over me to the point of self destruction. 

When it comes to emotions, the solution is often feeling them as opposed to simply experiencing them. 

Someone who constantly experiences fear will fall prey to it very quickly, where those who truly feel it, learn how to master it in a more constructive manner. Dooku's hate towards the Jedi was petty at best; right up there with someone swapping political alliance, and in fact, that was his literal motivation - politics.",,,1609616431,{},ghusnxj,False,t3_kowb8u,False,True,t1_ghuqb5q,/r/StarWars/comments/kowb8u/what_if_you_would_use_the_dark_side_to_do_good/ghusnxj/,1609617757,1,True,False,StarWars,t5_2qi4s,,0,[],,
[],,Darkdragoon324,,2,[],,,dark,text,t2_rr777,False,False,[],"Who would buy this, this desk fan doesn't look like it's  keeping *anything* cool in the summer.",,,1609616421,{},ghusn7z,False,t3_kp3qkk,False,True,t3_kp3qkk,/r/StarWars/comments/kp3qkk/lets_not_lose_sight_of_what_a_real_true_star_wars/ghusn7z/,1609617745,2,True,False,StarWars,t5_2qi4s,,0,[],,
[],,SnooPineapples7470,,,[],,,,text,t2_4y2pyocl,False,False,[],I really wish they hadn’t made it into a kids show. I couldn’t take any if it seriously. It’s just a cliche heroic animated show that stakes its reputation through big characters (like Darth Vader) even though they don’t behave or act like live action.,,,1609616418,{},ghusmzt,False,t3_kox6fm,False,True,t3_kox6fm,/r/StarWars/comments/kox6fm/in_my_opinion_twilight_of_the_apprentice_was_some/ghusmzt/,1609617741,2,True,False,StarWars,t5_2qi4s,,0,[],,
[],,thelegoroom,,,[],,,,text,t2_1nzjlvp8,False,True,[],😉😉👍,,,1609616415,{},ghusmtk,True,t3_koxava,False,False,t1_ghulfty,/r/StarWars/comments/koxava/over_christmas_i_made_this_lego_scene_showing/ghusmtk/,1609617738,4,True,False,StarWars,t5_2qi4s,,0,[],,
[],,RoscoMan1,,,[],,,,text,t2_62xfsb1o,False,False,[],Heh. Anakin was both in and out.,,,1609616375,{},ghusjyq,False,t3_koxava,False,True,t1_ghu4594,/r/StarWars/comments/koxava/over_christmas_i_made_this_lego_scene_showing/ghusjyq/,1609617694,2,True,False,StarWars,t5_2qi4s,,0,[],,
[],,BarryGrayson,,2-4 bigFlair,[],6fd2c312-77ee-11e9-9eab-0ef350b1bb88,Obi-Wan Kenobi,dark,text,t2_1wqizxgo,False,False,[],"Even says ""the true story of baby yoda"". Id buy this just watch it burn like you my brother anakin ahaha",,,1609616354,{},ghusih9,False,t3_kp33hf,False,True,t1_ghurrvr,/r/StarWars/comments/kp33hf/they_accidentally_cropped_out_part_of_poes/ghusih9/,1609617671,2,True,False,StarWars,t5_2qi4s,,0,[],,
[],,Endo107,,7-17 bigFlair,[],ce99f0ec-77f2-11e9-95d5-0e216e434f70,Ahsoka Tano,dark,text,t2_4y8vlkye,False,False,[],"No problem! You put a lot of hard work into this, and you deserve all the thanks you can get!",,,1609616326,{},ghusgjn,False,t3_koxava,False,True,t1_ghusdxz,/r/StarWars/comments/koxava/over_christmas_i_made_this_lego_scene_showing/ghusgjn/,1609617639,2,True,False,StarWars,t5_2qi4s,,0,[],,
[],,TLM86,,1-3 bigFlair,[],e936c4d4-77ed-11e9-ad90-0ec1639f6d96,Jedi,dark,text,t2_98lb6,False,False,[],"Boba hasn't appeared in any post-ROTJ content in canon until Mando. But him being in Mando doesn't invalidate any pre-ROTJ canon content.

Legends is everything released before 2014 aside from the six films and *The Clone Wars*. It's nothing to do with being invalidated by the prequels.",,,1609616306,{},ghusf3x,False,t3_kp3qp9,False,True,t1_ghurn52,/r/StarWars/comments/kp3qp9/question_about_mauls_timeline/ghusf3x/,1609617616,2,True,False,StarWars,t5_2qi4s,,0,[],,
[],,WatchBat,,2-6 bigFlair,[],76eab074-77ee-11e9-a80e-0ec377e51954,Sith Anakin,dark,text,t2_4uipmj27,False,False,[],"They still recognized him as a previous Jedi Master, but Obi-Wan's reaction in ANH doesn't fit imo, he looked as he was surprised like he was not recognized in 20 years, not just 5.",,,1609616299,{},ghusell,False,t3_kp36tq,False,True,t1_ghurcie,/r/StarWars/comments/kp36tq/the_kenobi_show_and_continuity/ghusell/,1609617608,3,True,False,StarWars,t5_2qi4s,,0,[],,
[],,thelegoroom,,,[],,,,text,t2_1nzjlvp8,False,True,[],Thank you 👍,,,1609616290,{},ghusdxz,True,t3_koxava,False,True,t1_ghus2oe,/r/StarWars/comments/koxava/over_christmas_i_made_this_lego_scene_showing/ghusdxz/,1609617597,1,True,False,StarWars,t5_2qi4s,,0,[],,
[],,Specimen-B,,1-4 bigFlair,[],58314e96-5eb9-11e1-9a9d-12313d18ad57,Sith,dark,text,t2_15yygx,False,False,[],"Yea, PT haters had similar anecdotes and stats back in the day. Every reason in the book for why any kids they knew hated the prequels and vastly preferred the OT and EU. And yet, here we are.",,,1609616226,{},ghus9mc,False,t3_konkwc,False,True,t1_ghs8j91,/r/StarWars/comments/konkwc/do_you_think_people_will_start_to_like_the/ghus9mc/,1609617530,1,True,False,StarWars,t5_2qi4s,,0,[],,
[],,topolsek123,,1-4 bigFlair,[],ea36e1a2-77ed-11e9-ac22-0ed4e462d1b6,Sith,dark,text,t2_3h1co85o,False,False,[],I think it's just her singing a song,,,1609616181,{},ghus6jp,False,t3_kp2ms4,False,True,t3_kp2ms4,/r/StarWars/comments/kp2ms4/sing_song_is_how_you_pronounce_xi_an_you_tell_me/ghus6jp/,1609617483,1,True,False,StarWars,t5_2qi4s,,0,[],,
[],,Haggerstonian,,,[],,,,text,t2_702k5abu,False,False,[],I would’ve said......who the fuck is Grogu,,,1609616175,{},ghus63l,False,t3_koxava,False,True,t1_ghu9hm2,/r/StarWars/comments/koxava/over_christmas_i_made_this_lego_scene_showing/ghus63l/,1609617476,2,True,False,StarWars,t5_2qi4s,,0,[],,
[],,AnthonySpeaks,,,[],,,,text,t2_186d1q3,False,False,[],Isn’t that was the new Bad Batch show basically is?,,,1609616152,{},ghus4f1,False,t3_kp3u4m,False,False,t3_kp3u4m,/r/StarWars/comments/kp3u4m/who_would_want_the_clone_wars_to_have_season_8/ghus4f1/,1609617451,5,True,False,StarWars,t5_2qi4s,,0,[],,
[],,Nightroad_Rider13,,,[],,,,text,t2_a8zanz9,False,False,[],It's not the storm troopers fault they have bad helmet designs.,,,1609616146,{},ghus40g,False,t3_kp3y4r,False,True,t3_kp3y4r,/r/StarWars/comments/kp3y4r/bad_aim_goes_brrrre/ghus40g/,1609617445,2,True,False,StarWars,t5_2qi4s,,0,[],,
[],,TLM86,,1-3 bigFlair,[],e936c4d4-77ed-11e9-ad90-0ec1639f6d96,Jedi,dark,text,t2_98lb6,False,False,[],It'd look like that bit in Wallace &amp; Gromit.,,,1609616145,{},ghus3xf,False,t3_kp3yra,False,True,t3_kp3yra,/r/StarWars/comments/kp3yra/what_if_a_gonk_droid_falls_over/ghus3xf/,1609617442,0,True,False,StarWars,t5_2qi4s,,0,[],,
[],,Troodon_wt,,,[],,,,text,t2_4lxxryph,False,False,[],"Than you are short sighted fool. I do not mean to be rude, but I have to ask how much mind bending and mental gymnastics are gonna be required next time? 

Vader outright says: ""The circle is now complete. When I left you I was but a lerner now I am the master."" with Ben Kenobi awnsering: ""Only a master of evil Darth.""

I am pretty sure that this means the last time they met was when Anakin ceased to be Jedi eg. Mustafar with the context of the prequels.",,,1609616129,{},ghus2v3,False,t3_kp36tq,False,True,t1_ghuo6mm,/r/StarWars/comments/kp36tq/the_kenobi_show_and_continuity/ghus2v3/,1609617427,0,True,False,StarWars,t5_2qi4s,,0,[],,
[],,Endo107,,7-17 bigFlair,[],ce99f0ec-77f2-11e9-95d5-0e216e434f70,Ahsoka Tano,dark,text,t2_4y8vlkye,False,False,[],God that is beautiful. Kudos to you!,,,1609616127,{},ghus2oe,False,t3_koxava,False,True,t3_koxava,/r/StarWars/comments/koxava/over_christmas_i_made_this_lego_scene_showing/ghus2oe/,1609617424,2,True,False,StarWars,t5_2qi4s,,0,[],,
[],,Nekosama7734,,1-1 bigFlair,[],d75ad9c6-77ed-11e9-89ad-0ee75ac9db5e,Rebel,dark,text,t2_2m1zuokm,False,False,[],"I remember at one point there was a padawan spin-off rumored.  
Yes I wish they could’ve done more, Asaaj/Quinlan arc, Maul escape/ruling Mandalore...",,,1609616112,{},ghus1m1,False,t3_kp3u4m,False,True,t3_kp3u4m,/r/StarWars/comments/kp3u4m/who_would_want_the_clone_wars_to_have_season_8/ghus1m1/,1609617407,1,True,False,StarWars,t5_2qi4s,,0,[],,
"[{'award_sub_type': 'GLOBAL', 'award_type': 'global', 'awardings_required_to_grant_benefits': None, 'coin_price': 100, 'coin_reward': 0, 'count': 1, 'days_of_drip_extension': 0, 'days_of_premium': 0, 'description': ""Shows the Silver Award... and that's it."", 'end_date': None, 'giver_coin_reward': None, 'icon_format': None, 'icon_height': 512, 'icon_url': 'https://www.redditstatic.com/gold/awards/icon/silver_512.png', 'icon_width': 512, 'id': 'gid_1', 'is_enabled': True, 'is_new': False, 'name': 'Silver', 'penny_donate': None, 'penny_price': None, 'resized_icons': [{'height': 16, 'url': 'https://www.redditstatic.com/gold/awards/icon/silver_16.png', 'width': 16}, {'height': 32, 'url': 'https://www.redditstatic.com/gold/awards/icon/silver_32.png', 'width': 32}, {'height': 48, 'url': 'https://www.redditstatic.com/gold/awards/icon/silver_48.png', 'width': 48}, {'height': 64, 'url': 'https://www.redditstatic.com/gold/awards/icon/silver_64.png', 'width': 64}, {'height': 128, 'url': 'https://www.redditstatic.com/gold/awards/icon/silver_128.png', 'width': 128}], 'resized_static_icons': [{'height': 16, 'url': 'https://www.redditstatic.com/gold/awards/icon/silver_16.png', 'width': 16}, {'height': 32, 'url': 'https://www.redditstatic.com/gold/awards/icon/silver_32.png', 'width': 32}, {'height': 48, 'url': 'https://www.redditstatic.com/gold/awards/icon/silver_48.png', 'width': 48}, {'height': 64, 'url': 'https://www.redditstatic.com/gold/awards/icon/silver_64.png', 'width': 64}, {'height': 128, 'url': 'https://www.redditstatic.com/gold/awards/icon/silver_128.png', 'width': 128}], 'start_date': None, 'static_icon_height': 512, 'static_icon_url': 'https://www.redditstatic.com/gold/awards/icon/silver_512.png', 'static_icon_width': 512, 'subreddit_coin_reward': 0, 'subreddit_id': None, 'tiers_by_required_awardings': None}]",,Gonk-Bot,,,[],,,,text,t2_6f64kub3,False,False,[],**GONK!**,,,1609616096,{'gid_1': 1},ghus0in,False,t3_kp3yra,False,False,t1_ghuryw1,/r/StarWars/comments/kp3yra/what_if_a_gonk_droid_falls_over/ghus0in/,1609617390,4,True,False,StarWars,t5_2qi4s,,1,[],,
[],,topolsek123,,1-4 bigFlair,[],ea36e1a2-77ed-11e9-ac22-0ed4e462d1b6,Sith,dark,text,t2_3h1co85o,False,False,[],Oy when Vader showed up in Fallen Order I was so gassed,,,1609616084,{},ghurznz,False,t3_kp2zeb,False,True,t3_kp2zeb,/r/StarWars/comments/kp2zeb/whats_your_favourite_part_of_disney_era_star_wars/ghurznz/,1609617375,0,True,False,StarWars,t5_2qi4s,,0,[],,
[],,Pugzalay,,1-13 bigFlair,[],f5e81c50-77ed-11e9-b7c9-0ed6380f0a18,Imperial Stormtrooper,dark,text,t2_8jt490ul,False,False,[],*Sad gonk*,,,1609616073,{},ghuryw1,False,t3_kp3yra,False,True,t3_kp3yra,/r/StarWars/comments/kp3yra/what_if_a_gonk_droid_falls_over/ghuryw1/,1609617363,3,True,False,StarWars,t5_2qi4s,,0,[],,
[],,chains059,,,[],,,,text,t2_120u9d,False,False,[],Where do u live? I’ll be there,,,1609616069,{},ghuryl3,False,t3_kp3u8l,False,True,t3_kp3u8l,/r/StarWars/comments/kp3u8l/just_became_ruler_of_mandalore_feels_good/ghuryl3/,1609617357,1,True,False,StarWars,t5_2qi4s,,0,[],,
[],,NBSPNBSP,,,[],,,,text,t2_1yqao1aa,False,False,[],"I usually just feint and disengage in order to see what the opponent will do when I actually attack. It's not a perfect strategy, but it works well enough.",,,1609616066,{},ghurydp,False,t3_koh4yi,False,True,t1_ghunytk,/r/StarWars/comments/koh4yi/this_is_an_exceptional_explanation_for_that_one/ghurydp/,1609617354,1,True,False,StarWars,t5_2qi4s,,0,[],,
[],,ryanindustries,,,[],,,,text,t2_acc7b,False,False,[],I do have the deah sentence on 12 systems,,,1609616065,{},ghurybp,True,t3_kp24z3,False,True,t1_ghur304,/r/StarWars/comments/kp24z3/i_thought_this_hole_on_a_truck_look_like_slave_1/ghurybp/,1609617353,1,True,False,StarWars,t5_2qi4s,,0,[],,
[],,NickyBananas,,,[],,,,text,t2_6mrro,False,False,[],People really fucking stretch to defend those movies,,,1609616042,{},ghurwq0,False,t3_knuc4u,False,True,t1_ghn6m83,/r/StarWars/comments/knuc4u/mark_hamill_loved_seeing_fans_reactions_to_the/ghurwq0/,1609617328,1,True,False,StarWars,t5_2qi4s,,0,[],,
[],,SergeantFeetPics,,,[],,,,text,t2_98cdream,False,False,[],He lookin a little blazed lol,,,1609616034,{},ghurw5z,False,t3_kp18pe,False,True,t3_kp18pe,/r/StarWars/comments/kp18pe/had_a_go_at_drawing_darth_maul_hope_you_guys_like/ghurw5z/,1609617320,0,True,False,StarWars,t5_2qi4s,,0,[],,
[],,DTURPLESMITH,,,[],,,,text,t2_535zf8r3,False,False,[],That looks great!,,,1609616030,{},ghurvvc,False,t3_kp3amr,False,True,t3_kp3amr,/r/StarWars/comments/kp3amr/my_second_lego_moc_the_tie_echelon_straight_from/ghurvvc/,1609617315,1,True,False,StarWars,t5_2qi4s,,0,[],,
[],,SheikhofdaStreez,,,[],,,,text,t2_849g9o3w,False,True,[],Is this the tic tac video the navy released??,,,1609616021,{},ghurv8e,False,t3_kp24z3,False,True,t1_ghuhli2,/r/StarWars/comments/kp24z3/i_thought_this_hole_on_a_truck_look_like_slave_1/ghurv8e/,1609617305,1,True,False,StarWars,t5_2qi4s,,0,[],,
[],,topolsek123,,1-4 bigFlair,[],ea36e1a2-77ed-11e9-ac22-0ed4e462d1b6,Sith,dark,text,t2_3h1co85o,False,False,[],I don't think it came out,,,1609615984,{},ghursmw,False,t3_kp30ze,False,True,t3_kp30ze,/r/StarWars/comments/kp30ze/new_lego_starwars/ghursmw/,1609617264,1,True,False,StarWars,t5_2qi4s,,0,[],,
[],,tbhcorn,,,[],,,,text,t2_1rzeg16,False,False,[],Thank you!,,,1609615980,{},ghursf1,True,t3_kopnjr,False,True,t1_ghsoie4,/r/StarWars/comments/kopnjr/just_finished_all_films_for_the_first_time/ghursf1/,1609617261,2,True,False,StarWars,t5_2qi4s,,0,[],,
[],,WatchBat,,2-6 bigFlair,[],76eab074-77ee-11e9-a80e-0ec377e51954,Sith Anakin,dark,text,t2_4uipmj27,False,False,[],"They included The Mandalorian but not the prequels, ""The complete guide"" lol

Edit: that without mentioning all the animations",,,1609615973,{},ghurrvr,False,t3_kp33hf,False,True,t1_ghunc8d,/r/StarWars/comments/kp33hf/they_accidentally_cropped_out_part_of_poes/ghurrvr/,1609617252,1,True,False,StarWars,t5_2qi4s,,0,[],,
[],,tbhcorn,,,[],,,,text,t2_1rzeg16,False,False,[],9 was very choppy!,,,1609615970,{},ghurrq7,True,t3_kopnjr,False,True,t1_ghtfro4,/r/StarWars/comments/kopnjr/just_finished_all_films_for_the_first_time/ghurrq7/,1609617250,1,True,False,StarWars,t5_2qi4s,,0,[],,
[],,tbhcorn,,,[],,,,text,t2_1rzeg16,False,False,[],Interesting how 9 is above 8/7!,,,1609615949,{},ghurq9p,True,t3_kopnjr,False,True,t1_ghu54xd,/r/StarWars/comments/kopnjr/just_finished_all_films_for_the_first_time/ghurq9p/,1609617224,1,True,False,StarWars,t5_2qi4s,,0,[],,
[],,MittenMagick,,,[],,,,text,t2_c0ku5,False,False,[],"I dunno, she didn't do a barrel roll from prone as she flew like a human lightsaber-tipped bullet towards an opponent, so it was kind of out of left field.",,,1609615946,{},ghurq33,False,t3_kop772,False,True,t1_ghtteop,/r/StarWars/comments/kop772/anakin_unknowingly_imitates_darth_mauls_enraged/ghurq33/,1609617221,1,True,False,StarWars,t5_2qi4s,,0,[],,
[],,tbhcorn,,,[],,,,text,t2_1rzeg16,False,False,[],I’m very excited for Mando s3 and TBoBF!,,,1609615935,{},ghurpbi,True,t3_kopnjr,False,False,t1_ghumbrm,/r/StarWars/comments/kopnjr/just_finished_all_films_for_the_first_time/ghurpbi/,1609617209,2,True,False,StarWars,t5_2qi4s,,0,[],,
[],,BarryGrayson,,2-4 bigFlair,[],6fd2c312-77ee-11e9-9eab-0ef350b1bb88,Obi-Wan Kenobi,dark,text,t2_1wqizxgo,False,False,[],"Id like to see the ""whos line is it anyways"" star wars parody for sure",,,1609615931,{},ghurozo,False,t3_kp3uu0,False,True,t3_kp3uu0,/r/StarWars/comments/kp3uu0/your_pal_friendpatine/ghurozo/,1609617204,1,True,False,StarWars,t5_2qi4s,,0,[],,
[],,CptShaggy88,,,[],,,,text,t2_23xsyo01,False,False,[],I didn't get AC vibes from it. But it's a great game nonetheless.,,,1609615911,{},ghurnoy,False,t3_kp3k6k,False,True,t3_kp3k6k,/r/StarWars/comments/kp3k6k/any_assassins_creed_fans_here/ghurnoy/,1609617185,1,True,False,StarWars,t5_2qi4s,,0,[],,
[],,Ozark87,,1-7 bigFlair,[],ed7f309e-77ed-11e9-b4ed-0e5f7c49fc06,Mandalorian,dark,text,t2_1tmb1io6,False,False,[],"So he never appeared in any sort of media, aside from clone wars, until Mando?

I know certain things he was in became legends because of the prequels, but aside from that, he was never in anything?",,,1609615903,{},ghurn52,False,t3_kp3qp9,False,False,t3_kp3qp9,/r/StarWars/comments/kp3qp9/question_about_mauls_timeline/ghurn52/,1609617176,2,True,False,StarWars,t5_2qi4s,,0,[],,
[],,not_a-replicant,#edeff1,3-1 bigFlair,[],e112365c-77ee-11e9-96d5-0e02fa4e8f0a,Luke Skywalker,dark,text,t2_xeqz9,False,False,[],"TLJ, easily. 

Rogue One, TCW Season 7, Rebels, Battlefront II, Fallen Order, Galaxy’s Edge, and Mando are also highlights. 

There’s a lot to like.",,,1609615885,{},ghurlvz,False,t3_kp2zeb,False,True,t3_kp2zeb,/r/StarWars/comments/kp2zeb/whats_your_favourite_part_of_disney_era_star_wars/ghurlvz/,1609617156,1,True,False,StarWars,t5_2qi4s,,0,[],,
[],,TLM86,,1-3 bigFlair,[],e936c4d4-77ed-11e9-ad90-0ec1639f6d96,Jedi,dark,text,t2_98lb6,False,False,[],"Hey, that's a Rifftrax line!",,,1609615872,{},ghurkvn,False,t3_kp3uu0,False,True,t3_kp3uu0,/r/StarWars/comments/kp3uu0/your_pal_friendpatine/ghurkvn/,1609617140,0,True,False,StarWars,t5_2qi4s,,0,[],,
[],,mairondil,,,[],,,,text,t2_6c9hb,False,False,[],"Based on the comments this has generated, I'm not the one that appears to be upset.",,,1609615866,{},ghurkdf,True,t3_kp0uha,False,False,t1_ghue06x,/r/StarWars/comments/kp0uha/are_ot_purists_nothing_more_than_mswga/ghurkdf/,1609617132,1,True,False,StarWars,t5_2qi4s,,0,[],,
[],,knifekld,,1-4 bigFlair,[],ea36e1a2-77ed-11e9-ac22-0ed4e462d1b6,Sith,dark,text,t2_163d9d,False,False,[],The MGS track makes it 10x better!,,,1609615861,{},ghurjzi,False,t3_kp1de6,False,True,t3_kp1de6,/r/StarWars/comments/kp1de6/george_lucas_videobombing_a_random_documentary/ghurjzi/,1609617126,1,True,False,StarWars,t5_2qi4s,,0,[],,
[],,SimpleTension,,,[],,,,text,t2_61tsek16,False,False,[],youtini.com,,,1609615851,{},ghurjaz,False,t3_koye53,False,True,t1_ghu2hi5,/r/StarWars/comments/koye53/ive_begun_the_daunting_task_of_going_through_the/ghurjaz/,1609617115,1,True,False,StarWars,t5_2qi4s,,0,[],,
[],,papamoonshine,,,[],,,,text,t2_8x5bnnt0,False,False,[],I think the last jedi gets alot of undeserved shit. It's my favorite of the sequel trilogy. Mandalorian is probably my favorite since Disney era,,,1609615841,{},ghurio1,False,t3_kp2zeb,False,True,t1_ghup6s6,/r/StarWars/comments/kp2zeb/whats_your_favourite_part_of_disney_era_star_wars/ghurio1/,1609617105,2,True,False,StarWars,t5_2qi4s,,0,[],,
