all_awardings,associated_award,author,author_flair_background_color,author_flair_css_class,author_flair_richtext,author_flair_template_id,author_flair_text,author_flair_text_color,author_flair_type,author_fullname,author_patreon_flair,author_premium,awarders,body,collapsed_because_crowd_control,comment_type,created_utc,gildings,id,is_submitter,link_id,locked,no_follow,parent_id,permalink,retrieved_on,score,send_replies,stickied,subreddit,subreddit_id,top_awarded_type,total_awards_received,treatment_tags,author_cakeday,distinguished
[],,diane_mrap,,,[],,,,text,t2_6lfrrddu,False,False,[],Just watched Empire Strikes Back this morning and this gives me so many feelsss,,,1609610192,{},ghuggwl,False,t3_kowthk,False,True,t3_kowthk,/r/StarWars/comments/kowthk/chewie_and_threepio/ghuggwl/,1609610803,1,True,False,StarWars,t5_2qi4s,,0,[],,
[],,TKHarts,,,[],,,,text,t2_1ev2yz0,False,False,[],I mean it's just not that aesthetically pleasing to me. Plus I'm still not over how they explained Ahsoka surviving Vader when there could have been millions of other more plausible options. Such as temple collapses and Ahsoka escapes...etc,,,1609610179,{},ghugfz5,False,t3_kox6fm,False,True,t3_kox6fm,/r/StarWars/comments/kox6fm/in_my_opinion_twilight_of_the_apprentice_was_some/ghugfz5/,1609610788,1,True,False,StarWars,t5_2qi4s,,0,[],,
[],,MagGamer,,,[],,,,text,t2_15y4rz,False,False,[],True that. They never care about the damn troops. Smh,,,1609610171,{},ghugfgj,True,t3_kot548,False,True,t1_ghtxzhv,/r/StarWars/comments/kot548/drop_comments_on_things_that_dont_add_up_in/ghugfgj/,1609610781,1,True,False,StarWars,t5_2qi4s,,0,[],,
[],,BaldViking42,,,[],,,,text,t2_8uokaajr,False,False,[],Hahaha the 4th along I've had as my phone and laptop background for over a year now how did you make these???,,,1609610054,{},ghug72b,False,t3_kovrcn,False,True,t3_kovrcn,/r/StarWars/comments/kovrcn/i_had_made_these_during_christmas_holidays_hope/ghug72b/,1609610646,1,True,False,StarWars,t5_2qi4s,,0,[],,
[],,VaultBoy42,,3-10 bigFlair,[],364eda62-77ef-11e9-939b-0e1ee5586816,Lando Calrissian,dark,text,t2_ag7y2,False,False,[],I can only assume it’s a Covid situation. Even in a few shots of the one episode we got there were already people starting to wear masks.,,,1609610023,{},ghug4vr,False,t3_kp1mii,False,True,t3_kp1mii,/r/StarWars/comments/kp1mii/season_2_of_gallery_is_only_1_episode_long/ghug4vr/,1609610610,1,True,False,StarWars,t5_2qi4s,,0,[],,
[],,InvictusDaemon,,,[],,,,text,t2_oc7fv,False,False,[],"It takes more than a ""second"" or moment to sense the darkness, decide in the middle of the night to walk to Ben's hut, pull your lightsaber, contemplate making a killing blow and thus drawing then igniting his lightsaber. All of this while logically rationalizing why it is his only course of action.

The movie portrays this more as a premeditated and self rationalized murder that he couldn't go through with at the last second. Not some instant rush of irrational homicide that passed in an moment.",,,1609610010,{},ghug3yg,False,t3_kozlhv,False,True,t1_ghudj1s,/r/StarWars/comments/kozlhv/the_mandalorian_has_made_me_appreciate_tlj_more/ghug3yg/,1609610596,1,True,False,StarWars,t5_2qi4s,,0,[],,
[],,GregThePrettyGoodGuy,,44,[],,,dark,text,t2_10d5d4,False,True,[],"I mean, they’re talking about something fundamentally unimportant - a movie, so no",,,1609609995,{},ghug2wq,False,t3_kp0uha,False,True,t3_kp0uha,/r/StarWars/comments/kp0uha/are_ot_purists_nothing_more_than_mswga/ghug2wq/,1609610580,1,True,False,StarWars,t5_2qi4s,,0,[],,
[],,MikeRegrets,,,[],,,,text,t2_yms2v,False,False,[],"Not that there isn't sadly too much overlap, but comparing uptight nerds to actual Nazis is a bit hyperbolic",,,1609609993,{},ghug2sp,False,t3_kp0uha,False,True,t3_kp0uha,/r/StarWars/comments/kp0uha/are_ot_purists_nothing_more_than_mswga/ghug2sp/,1609610578,1,True,False,StarWars,t5_2qi4s,,0,[],,
[],,not_a-replicant,#edeff1,3-1 bigFlair,[],e112365c-77ee-11e9-96d5-0e02fa4e8f0a,Luke Skywalker,dark,text,t2_xeqz9,False,False,[],"&gt; Luke's change in TLJ goes beyond simply ideology, which would be fine. It's believable to drastically change your mindset after a traumatic experience. It's not believable to change your core characteristic behavior. Instead of him being just disillusioned (which would be fine), he's also rude, messy, and uncaring. He throws the lightsaber away, he ignores Rey, tells her to go away, and spends the entire film just being a jerk. Who is this rude asshole? Where is Luke? Luke, disillusioned or not, it is very hard to believe that this is the same character. This appears to be an entirely new one.

He’s uncaring? What?

TLJ portrays a Luke that cares deeply about everything. He’s so affected by what happens, he goes into isolation. He clearly wants to help, but is paralyzed by his fear and guilt. 

These other traits (rude, disillusioned) are symptoms of that guilt. He’s trying to rationalize his errors. He’s doing what we all do. But TLJ as a movie doesn’t let him get away with that. 

&gt; Ask yourself, what character traits does TLJ share with ROTJ Luke besides the name? 

They’re both highly emotional, caring, quick to act/react, struggling with fear/darkside, and ultimately good. They’re the same character. 

What’s Luke’s defining trait in the OT? His struggle to control his fears and combat the darkside. That’s a lifelong struggle. And it forms the core of his arc in the sequels.",,,1609609992,{},ghug2q5,False,t3_kozlhv,False,True,t1_ghuczz3,/r/StarWars/comments/kozlhv/the_mandalorian_has_made_me_appreciate_tlj_more/ghug2q5/,1609610577,1,True,False,StarWars,t5_2qi4s,,0,[],,
[],,topolsek123,,1-4 bigFlair,[],ea36e1a2-77ed-11e9-ac22-0ed4e462d1b6,Sith,dark,text,t2_3h1co85o,False,False,[],*points gun* you disin clone wars?,,,1609609982,{},ghug207,False,t3_kov9xb,False,True,t1_ghuar63,/r/StarWars/comments/kov9xb/i_want_to_binge_sw_help/ghug207/,1609610565,1,True,False,StarWars,t5_2qi4s,,0,[],,
[],,Doopadaptap,,,[],,,,text,t2_620o8akd,False,False,[],How? They look so....smooth and round?,,,1609609940,{},ghufz0f,False,t3_koxava,False,True,t3_koxava,/r/StarWars/comments/koxava/over_christmas_i_made_this_lego_scene_showing/ghufz0f/,1609610517,1,True,False,StarWars,t5_2qi4s,,0,[],,
[],,DogmaticNuance,,,[],,,,text,t2_2ivpf57k,False,False,[],"No, not at all. Their blades go behind their backs, that's not going to parry anything. It's also meant to move a lunge off line, not block a sweeping chop (which isn't really a thing in fencing).

It's still just as goofy as it always was and closer to dancing than fighting.",,,1609609928,{},ghufy4d,False,t3_koh4yi,False,True,t1_ghtg4jr,/r/StarWars/comments/koh4yi/this_is_an_exceptional_explanation_for_that_one/ghufy4d/,1609610503,1,True,False,StarWars,t5_2qi4s,,0,[],,
[],,Oraukk,,26,[],,,dark,text,t2_53fog,False,False,[],The yolk doesn't turn into the chicken.  The yolk is the source of energy and nutrients,,,1609609922,{},ghufxpj,False,t3_koubiz,False,True,t1_ghueo48,/r/StarWars/comments/koubiz/poor_mudhorn/ghufxpj/,1609610496,1,True,False,StarWars,t5_2qi4s,,0,[],,
[],,depressedemobitxh,,,[],,,,text,t2_86mbi7kp,False,False,[],Damn thats stupidly good,,,1609609919,{},ghufxhr,False,t3_kp18pe,False,True,t3_kp18pe,/r/StarWars/comments/kp18pe/had_a_go_at_drawing_darth_maul_hope_you_guys_like/ghufxhr/,1609610493,1,True,False,StarWars,t5_2qi4s,,0,[],,
[],,An_Casiil,,,[],,,,text,t2_3np56s12,False,False,[],Oh man just got a strong nostalgia slap straight to the feels,,,1609609891,{},ghufvi5,False,t3_kp0yku,False,True,t3_kp0yku,/r/StarWars/comments/kp0yku/this_gem_just_got_even_shinier_with_the_book_of/ghufvi5/,1609610461,1,True,False,StarWars,t5_2qi4s,,0,[],,
[],,paranormalscience21,,,[],,,,text,t2_43lvlbpv,False,False,[],The new republic is not the Resistance though,,,1609609867,{},ghuftq0,False,t3_kp1jj0,False,True,t3_kp1jj0,/r/StarWars/comments/kp1jj0/new_republic_theme/ghuftq0/,1609610431,1,True,False,StarWars,t5_2qi4s,,0,[],,
[],,That_Soulless_Ginger,,,[],,,,text,t2_16p5wg,False,False,[],"Ummm news flash, but there’s also like 20 books about Boba’s return, becoming Mandalore, and training Han and Leia’s daughter to fight Jedi so she can defeat her brother.",,,1609609863,{},ghuftfb,False,t3_koslob,False,True,t1_ghu1i1p,/r/StarWars/comments/koslob/plo_koon_is_alive_and_will_return_soon_and_here/ghuftfb/,1609610426,1,True,False,StarWars,t5_2qi4s,,0,[],,
[],,BarryGrayson,,2-4 bigFlair,[],6fd2c312-77ee-11e9-9eab-0ef350b1bb88,Obi-Wan Kenobi,dark,text,t2_1wqizxgo,False,False,[],"Can you elaborate the tonal diffrence?

Kylo is vader jr. Rey is luke jr. Execpt instead of im your father. Im your lover..... And palps is there again. Just to explain it was gim doing everything like the prequels.

My issue is they copied half the ot but then went around like wait were this all new thing. No your not lol.

The new chars were ot rip offs and the old chars had those new ideas they had

 all they had to do was give the storys to the opposite characters.",,,1609609798,{},ghufor8,False,t3_kp0uha,False,True,t1_ghue8m6,/r/StarWars/comments/kp0uha/are_ot_purists_nothing_more_than_mswga/ghufor8/,1609610354,1,True,False,StarWars,t5_2qi4s,,0,[],,
[],,Weckl0506,,,[],,,,text,t2_4uk4rwla,False,False,[],Younglings playtime decreases...,,,1609609775,{},ghufn4k,False,t3_koxava,False,True,t1_ghtyyhs,/r/StarWars/comments/koxava/over_christmas_i_made_this_lego_scene_showing/ghufn4k/,1609610330,1,True,False,StarWars,t5_2qi4s,,0,[],,
[],,DannyBurciaga,,,[],,,,text,t2_3ooreh5k,False,False,[],"I need a zip code, please",,,1609609757,{},ghuflri,True,t3_kp0slk,False,True,t1_ghuejct,/r/StarWars/comments/kp0slk/one_last_look_at_my_old_figures_before_putting/ghuflri/,1609610311,1,True,False,StarWars,t5_2qi4s,,0,[],,
[],,Responsible-Bat658,,,[],,,,text,t2_8dt3gus7,False,False,[],Back into the vault then,,,1609609749,{},ghufl77,False,t3_kozlhv,False,True,t1_ghufeby,/r/StarWars/comments/kozlhv/the_mandalorian_has_made_me_appreciate_tlj_more/ghufl77/,1609610302,1,True,False,StarWars,t5_2qi4s,,0,[],,
[],,Allronix1,,,[],,,,text,t2_p0l414t,False,False,[],"I get the impression of someone who is great at world building and ideas but has absolutely no concept of human psychology.

The fact that these film do poorly in real life Buddhist cultures is a tip off that he's just another Westerner trying to play up a non Western philosophy as something exotic and cool",,,1609609738,{},ghufkeq,False,t3_icjdim,False,True,t1_ghud2ea,/r/StarWars/comments/icjdim/george_lucas_on_attachment_and_greed/ghufkeq/,1609610289,1,True,False,StarWars,t5_2qi4s,,0,[],,
[],,topolsek123,,1-4 bigFlair,[],ea36e1a2-77ed-11e9-ac22-0ed4e462d1b6,Sith,dark,text,t2_3h1co85o,False,False,[],"I'm a strong believer that you can watch Mandalorian without watching zero other content, but the guy said ""binge star wars so I'm assuming he/she wants the whole thing",,,1609609716,{},ghufiw5,False,t3_kov9xb,False,True,t1_ghuar63,/r/StarWars/comments/kov9xb/i_want_to_binge_sw_help/ghufiw5/,1609610266,1,True,False,StarWars,t5_2qi4s,,0,[],,
[],,RedFive2005,,1-7 bigFlair,[],ed7f309e-77ed-11e9-b4ed-0e5f7c49fc06,Mandalorian,dark,text,t2_3uvpgtpm,False,False,[],That would be awesome to see and I want that in my life now,,,1609609716,{},ghufivc,False,t3_kp0gms,False,True,t1_ghu85yv,/r/StarWars/comments/kp0gms/non_human_mandos_in_the_mandalorian/ghufivc/,1609610265,1,True,False,StarWars,t5_2qi4s,,0,[],,
[],,blankwillow_,,,[],,,,text,t2_5acwyt3d,False,False,[],"In the Old EU, being a Mandalorian is a creed, not a bloodline.  Adoption of a young individual was considered the highest honor, and by doing so, brought in another warrior into the fold.  Hopefully, this is a practice introduced into the new canon.",,,1609609674,{},ghuffw1,False,t3_kp0gms,False,True,t3_kp0gms,/r/StarWars/comments/kp0gms/non_human_mandos_in_the_mandalorian/ghuffw1/,1609610218,1,True,False,StarWars,t5_2qi4s,,0,[],,
[],,VaultBoy42,,3-10 bigFlair,[],364eda62-77ef-11e9-939b-0e1ee5586816,Lando Calrissian,dark,text,t2_ag7y2,False,False,[],"Lol. You’re out here saying that the head of a business didn’t hire an employee of said business. And had basically nothing to do with the product that was produced. Despite the fact that the boss’ name is still all over the product, the boss and employee have both appeared together on screen talking with each other about the creation of the product. 

And you’re out here still baselessly claiming that the boss didn’t hire said employee. 

I think you were one of the people campaigning for separate universes. Dude, you’re already living in a different universe. I’m done.",,,1609609651,{},ghufeby,False,t3_kozlhv,False,False,t1_ghueudd,/r/StarWars/comments/kozlhv/the_mandalorian_has_made_me_appreciate_tlj_more/ghufeby/,1609610193,1,True,False,StarWars,t5_2qi4s,,0,[],,
[],,Variousnumber,,1-1 bigFlair,[],d75ad9c6-77ed-11e9-89ad-0ee75ac9db5e,Rebel,dark,text,t2_ptkrf,False,True,[],It's the sword. Hilt's not curved.,,,1609609624,{},ghufcd8,False,t3_kom0nz,False,True,t1_ghsybog,/r/StarWars/comments/kom0nz/i_like_to_photoshop_old_paintings_this_is_my_sith/ghufcd8/,1609610162,1,True,False,StarWars,t5_2qi4s,,0,[],,
[],,pinoman_,,,[],,,,text,t2_8catv7pu,False,False,[],Thanks!,,,1609609622,{},ghufc89,True,t3_kp0jyb,False,True,t1_ghue0um,/r/StarWars/comments/kp0jyb/i_changed_a_normal_atat_into_a_rebel_recovered/ghufc89/,1609610160,1,True,False,StarWars,t5_2qi4s,,0,[],,
[],,Allronix1,,,[],,,,text,t2_p0l414t,False,False,[],"Then why would marriage, kids, deep friendship be forbidden? Why conscript and indoctrinate from the cradle (it's horrible when it's the First Order, but totally fine for Jedi?! Smelling bantha crap)

The Jedi fear what they can't control which makes them not really different from what they fight in some regards.",,,1609609621,{},ghufc65,False,t3_icjdim,False,True,t1_ghuczk2,/r/StarWars/comments/icjdim/george_lucas_on_attachment_and_greed/ghufc65/,1609610159,1,True,False,StarWars,t5_2qi4s,,0,[],,
[],,BootyBootyFartFart,,,[],,,,text,t2_ewxcp,False,False,[],"This is probably my biggest with the fan base on here. I think the dialogue and characters are super mediocre to average in mando. Always had trouble getting into the animated series for a similar reason, though it does seem like the characters are probably stronger there.",,,1609609614,{},ghufbmu,False,t3_kox6fm,False,True,t3_kox6fm,/r/StarWars/comments/kox6fm/in_my_opinion_twilight_of_the_apprentice_was_some/ghufbmu/,1609610150,1,True,False,StarWars,t5_2qi4s,,0,[],,
[],,TheMangalo,,,[],,,,text,t2_mgnai,False,False,[],"ONE bombers payload was enough to annihilate an entire dreadnought, Poe just deployed them in a moronic strategy that was never supposed to be executed in the first place.",,,1609609613,{},ghufbkb,False,t3_kokbqc,False,False,t1_ghsvmvz,/r/StarWars/comments/kokbqc/saoirse_ronan_as_a_young_vice_admiral_amilyn_holdo/ghufbkb/,1609610148,1,True,False,StarWars,t5_2qi4s,,0,[],,
[],,Bl00dbag77,,,[],,,,text,t2_90slqyvg,False,False,[],That looks epic,,,1609609516,{},ghuf4rz,False,t3_koxava,False,True,t3_koxava,/r/StarWars/comments/koxava/over_christmas_i_made_this_lego_scene_showing/ghuf4rz/,1609610044,1,True,False,StarWars,t5_2qi4s,,0,[],,
[],,heyitsMog,,,[],,,,text,t2_8jqhqps,False,False,[],No animated series finale had me crying like that since ATLA,,,1609609512,{},ghuf4j0,False,t3_koguio,False,True,t1_ghr2j4e,/r/StarWars/comments/koguio/hope_ive_managed_to_hit_your_feels_with_this_one/ghuf4j0/,1609610040,1,True,False,StarWars,t5_2qi4s,,0,[],,
[],,aspKt_,,1-12 bigFlair,[],f4f5068c-77ed-11e9-add5-0e9fb131d2e8,Clone Trooper,dark,text,t2_45ij3wgb,False,False,[],This is epic!,,,1609609489,{},ghuf2y2,False,t3_koxava,False,True,t3_koxava,/r/StarWars/comments/koxava/over_christmas_i_made_this_lego_scene_showing/ghuf2y2/,1609610016,1,True,False,StarWars,t5_2qi4s,,0,[],,
[],,Responsible-Bat658,,,[],,,,text,t2_8dt3gus7,False,False,[],"Yeah definitely backwards. They took all the XWing’s Thai fighters the death star the force the light savers, all of the things that look like Star Wars on the surface. But when you don’t include Luke, Leah, han, Lando and you don’t even reunite them on screen once? They take away the things that feel like Star Wars",,,1609609481,{},ghuf2c6,False,t3_kp0uha,False,True,t1_ghuevcd,/r/StarWars/comments/kp0uha/are_ot_purists_nothing_more_than_mswga/ghuf2c6/,1609610006,1,True,False,StarWars,t5_2qi4s,,0,[],,
[],,BarryGrayson,,2-4 bigFlair,[],6fd2c312-77ee-11e9-9eab-0ef350b1bb88,Obi-Wan Kenobi,dark,text,t2_1wqizxgo,False,False,[],"Its weird they half just did ot again but At same time tried making it new with new ideas chars. But they kept bouncing from this we are the ot no  wait were brand new too when they werent.

Basiaclly. The new chars were ot rip offs and old chars were theyre new ideas personalitys. Like backwards if you ask me.",,,1609609382,{},ghuevcd,False,t3_kp0uha,False,True,t1_ghubhg9,/r/StarWars/comments/kp0uha/are_ot_purists_nothing_more_than_mswga/ghuevcd/,1609609894,1,True,False,StarWars,t5_2qi4s,,0,[],,
[],,Responsible-Bat658,,,[],,,,text,t2_8dt3gus7,False,False,[],"I am confident that after episode eight, Bob Iger has Reduced her influence over the brand.. There’s no way you’re going to trust Kathleen Kennedy with Star Wars after what she did with episode eight.       
      
And no, she didn’t hire Jon Favreau for the Mandalorian. It was his idea she and introduced him to Dave Filoni.",,,1609609369,{},ghueudd,False,t3_kozlhv,False,True,t1_ghueos5,/r/StarWars/comments/kozlhv/the_mandalorian_has_made_me_appreciate_tlj_more/ghueudd/,1609609879,1,True,False,StarWars,t5_2qi4s,,0,[],,
[],,downwithlordofcinder,,,[],,,,text,t2_3cj15kic,False,False,[],Why is your mustafar moc 10x better than the official set :0,,,1609609343,{},ghueshk,False,t3_koxava,False,False,t3_koxava,/r/StarWars/comments/koxava/over_christmas_i_made_this_lego_scene_showing/ghueshk/,1609609848,1,True,False,StarWars,t5_2qi4s,,0,[],,
[],,Puzzleheaded-Pain-41,,,[],,,,text,t2_8jsmh1hg,False,False,[],"Yeah, seemed pretty much implied this is the project that leads to the Snoke and Palpatine clones.",,,1609609341,{},ghuescv,False,t3_kfgv9t,False,True,t1_ggbzmrq,/r/StarWars/comments/kfgv9t/the_mandalorian_s2e8_discussion_thread/ghuescv/,1609609846,1,True,False,StarWars,t5_2qi4s,,0,[],,
[],,vidax20,,,[],,,,text,t2_65j6wlfe,False,False,[],this is incredible!!!!! excelent work!,,,1609609338,{},ghues4k,False,t3_koxava,False,True,t3_koxava,/r/StarWars/comments/koxava/over_christmas_i_made_this_lego_scene_showing/ghues4k/,1609609842,1,True,False,StarWars,t5_2qi4s,,0,[],,
[],,doctorctrl,,,[],,,,text,t2_70lz1,False,False,[],I have several friends who are huge star wars fans. Who refuse to even watch the clone wars because they're cartoons. But love and rewatch the animated promo mini movies for knights of the old republic. It annoys me so much,,,1609609321,{},ghueqv9,False,t3_kox6fm,False,True,t3_kox6fm,/r/StarWars/comments/kox6fm/in_my_opinion_twilight_of_the_apprentice_was_some/ghueqv9/,1609609820,1,True,False,StarWars,t5_2qi4s,,0,[],,
[],,fnaffankid,,,[],,,,text,t2_5hs4k3n9,False,False,[],Not mine,,,1609609308,{},ghuepy8,True,t3_kp1hhi,False,True,t1_ghuelkf,/r/StarWars/comments/kp1hhi/ima_just_leave_this_here/ghuepy8/,1609609805,1,True,False,StarWars,t5_2qi4s,,0,[],,
[],,VaultBoy42,,3-10 bigFlair,[],364eda62-77ef-11e9-939b-0e1ee5586816,Lando Calrissian,dark,text,t2_ag7y2,False,False,[],"She hired Favreau and Filoni for Mandalorian, just as she hired Rian for TLJ. And while she’s the head of Lucasfilm, she has the final say on everything Lucasfilm produces. 

So yes, she had the same amount of influence over the Mandalorian as she did TLJ.",,,1609609291,{},ghueos5,False,t3_kozlhv,False,True,t1_ghueef0,/r/StarWars/comments/kozlhv/the_mandalorian_has_made_me_appreciate_tlj_more/ghueos5/,1609609788,1,True,False,StarWars,t5_2qi4s,,0,[],,
[],,ry_clarke,,,[],,,,text,t2_8iotwqvz,False,False,[],true but it isn't just all yolk once it's been fertilised,,,1609609282,{},ghueo48,False,t3_koubiz,False,False,t1_ghty7z3,/r/StarWars/comments/koubiz/poor_mudhorn/ghueo48/,1609609776,1,True,False,StarWars,t5_2qi4s,,0,[],,
[],,Responsible-Bat658,,,[],,,,text,t2_8dt3gus7,False,False,[],"The man who would never abandon his friends, wouldn’t kill his own father, do you know what never mind. I think I need to know all I need to know from your reply. It’s just praise, Star Wars makes you happy who am I to stop that? Have a good day, may the force be with you.",,,1609609279,{},ghuenwl,False,t3_kozlhv,False,True,t1_ghuefet,/r/StarWars/comments/kozlhv/the_mandalorian_has_made_me_appreciate_tlj_more/ghuenwl/,1609609773,1,True,False,StarWars,t5_2qi4s,,0,[],,
[],,TakeTheQuickTwo,,,[],,,,text,t2_3mkqd3wt,False,False,[],"Lol this is just going around in circles.

All your ideas are dumb and awful and if they happened in the movie you would call them dumb.

Not liking a movie is fine, not understanding the very basic storyline because you didn’t like a character is stupid.",,,1609609276,{},ghuennk,False,t3_kokbqc,False,True,t1_ghu8jo6,/r/StarWars/comments/kokbqc/saoirse_ronan_as_a_young_vice_admiral_amilyn_holdo/ghuennk/,1609609769,1,True,False,StarWars,t5_2qi4s,,0,[],,
[],,Kingmarc568,,,[],,,,text,t2_5xfqycjk,False,False,[],But he used a Batman quote and it sounded universally usable (atleast if you have this opinion for some reason).,,,1609609251,{},ghuelu7,False,t3_kowb8u,False,False,t1_ghudu1a,/r/StarWars/comments/kowb8u/what_if_you_would_use_the_dark_side_to_do_good/ghuelu7/,1609609742,1,True,False,StarWars,t5_2qi4s,,0,[],,
[],,lapband45,,,[],,,,text,t2_3mob765k,False,False,[],masterpiece,,,1609609247,{},ghuelkf,False,t3_kp1hhi,False,True,t3_kp1hhi,/r/StarWars/comments/kp1hhi/ima_just_leave_this_here/ghuelkf/,1609609737,1,True,False,StarWars,t5_2qi4s,,0,[],,
[],,GillyMonster18,,,[],,,,text,t2_c5qiojw,False,False,[],"“That was pretty wizard, wasn’t it son?”

“W-what?”

“I’M BRINGING IT BACK!!”",,,1609609245,{},ghuelf9,False,t3_koxhev,False,True,t1_ghtwm2o,/r/StarWars/comments/koxhev/another_sebulba_sighting_from_my_building_at_work/ghuelf9/,1609609735,1,True,False,StarWars,t5_2qi4s,,0,[],,
[],,bufftbone,,,[],,,,text,t2_4no59,False,False,[],Very,,,1609609235,{},ghuekpn,False,t3_kor5os,False,True,t1_ghubxsj,/r/StarWars/comments/kor5os/raise_a_glass_not_to_the_empire_but_to_bill_burr/ghuekpn/,1609609724,1,True,False,StarWars,t5_2qi4s,,0,[],,
[],,dbuck79,,85,[],,,dark,text,t2_6inbi,False,False,[],My favorite set! Mine is hopefully still in my parents storage. Broken most likely however,,,1609609222,{},ghuejs0,False,t3_kp0yku,False,False,t3_kp0yku,/r/StarWars/comments/kp0yku/this_gem_just_got_even_shinier_with_the_book_of/ghuejs0/,1609609708,1,True,False,StarWars,t5_2qi4s,,0,[],,
[],,Elder_god_of_blood,,1-12 bigFlair,[],f4f5068c-77ed-11e9-add5-0e9fb131d2e8,Clone Trooper,dark,text,t2_5me4oyxc,False,False,[],"To East europe, how much is it",,,1609609216,{},ghuejct,False,t3_kp0slk,False,True,t1_ghue54e,/r/StarWars/comments/kp0slk/one_last_look_at_my_old_figures_before_putting/ghuejct/,1609609702,1,True,False,StarWars,t5_2qi4s,,0,[],,
[],,TakeTheQuickTwo,,,[],,,,text,t2_3mkqd3wt,False,False,[],"Ah yes, holdo and rose = dumb, Poe = smart


Hmmm",,,1609609213,{},ghuej4l,False,t3_kokbqc,False,False,t1_ghu7t2m,/r/StarWars/comments/kokbqc/saoirse_ronan_as_a_young_vice_admiral_amilyn_holdo/ghuej4l/,1609609698,1,True,False,StarWars,t5_2qi4s,,0,[],,
[],,Insanelystan,,,[],,,,text,t2_h0emsmj,False,False,[],The lights out and the saber lighting always gets me a thrill 😁,,,1609609176,{},ghuegil,False,t3_kp1ez4,False,True,t3_kp1ez4,/r/StarWars/comments/kp1ez4/another_one_falls_to_the_darkside_my_late/ghuegil/,1609609656,1,True,False,StarWars,t5_2qi4s,,0,[],,
[],,tommymikaelson,,,[],,,,text,t2_3zl6qdu2,False,False,[],"i see

Huh I wonder then what moff gideon is taking his orders from atm. Palpatine I guess

that sucks",,,1609609173,{},ghueg91,True,t3_kp0pse,False,True,t1_ghudshp,/r/StarWars/comments/kp0pse/spoilers_a_question_about_thrawn/ghueg91/,1609609652,1,True,False,StarWars,t5_2qi4s,,0,[],,
[],,princepsed,,,[],,,,text,t2_11o4oz,False,True,[],Thank you! I love that little guy 😭😭😭,,,1609609165,{},ghuefqi,True,t3_kp06sx,False,True,t1_ghudlmz,/r/StarWars/comments/kp06sx/ahsoka_knows_its_not_her_place_to_forgive_anakin/ghuefqi/,1609609644,1,True,False,StarWars,t5_2qi4s,,0,[],,
[],,VaultBoy42,,3-10 bigFlair,[],364eda62-77ef-11e9-939b-0e1ee5586816,Lando Calrissian,dark,text,t2_ag7y2,False,False,[],"I can reconcile it. I know who Luke is in the OT. And I know who he is in the ST. 

It’s an outstanding work of writing for Luke in the ST. And Mark elevates the writing even more with his acting.",,,1609609161,{},ghuefet,False,t3_kozlhv,False,True,t1_ghue6b5,/r/StarWars/comments/kozlhv/the_mandalorian_has_made_me_appreciate_tlj_more/ghuefet/,1609609639,1,True,False,StarWars,t5_2qi4s,,0,[],,
[],,TakeTheQuickTwo,,,[],,,,text,t2_3mkqd3wt,False,False,[],"Lol sound logic, can’t believe someone isn’t taking you seriously online",,,1609609161,{},ghuefem,False,t3_kokbqc,False,True,t1_ghu6k6g,/r/StarWars/comments/kokbqc/saoirse_ronan_as_a_young_vice_admiral_amilyn_holdo/ghuefem/,1609609638,1,True,False,StarWars,t5_2qi4s,,0,[],,
[],,[deleted],,,,,,dark,,,,,[],[removed],,,1609609160,{},ghuefe1,False,t3_kozlhv,False,True,t1_ghub8jl,/r/StarWars/comments/kozlhv/the_mandalorian_has_made_me_appreciate_tlj_more/ghuefe1/,1609609638,1,True,False,StarWars,t5_2qi4s,,0,[],,
