all_awardings,associated_award,author,author_flair_background_color,author_flair_css_class,author_flair_richtext,author_flair_template_id,author_flair_text,author_flair_text_color,author_flair_type,author_fullname,author_patreon_flair,author_premium,awarders,body,collapsed_because_crowd_control,comment_type,created_utc,gildings,id,is_submitter,link_id,locked,no_follow,parent_id,permalink,retrieved_on,score,send_replies,stickied,subreddit,subreddit_id,top_awarded_type,total_awards_received,treatment_tags,author_cakeday,distinguished
[],,rustystrings1991,,,[],,,,text,t2_7t7yyu40,False,False,[],I might look up a guide to see what episodes i can skip and head straight in to season 2,,,1609598080,{},ghturvk,False,t3_kox6fm,False,True,t1_ghtulq8,/r/StarWars/comments/kox6fm/in_my_opinion_twilight_of_the_apprentice_was_some/ghturvk/,1609598090,1,True,False,StarWars,t5_2qi4s,,0,[],,
[],,lana2211,,,[],,,,text,t2_70dyddk2,False,False,[],"Surprisingly good. I watched so many macaron videos, i saw macarons in my dreams lol",,,1609598029,{},ghtup7d,True,t3_koy8fy,False,True,t1_ghtuc7p,/r/StarWars/comments/koy8fy/first_attempt_at_baby_yoda_macarons_and_my_first/ghtup7d/,1609598039,1,True,False,StarWars,t5_2qi4s,,0,[],,
[],,[deleted],,,,,,dark,,,,,[],[removed],,,1609598026,{},ghtup2l,False,t3_kop772,False,True,t1_ghtliqi,/r/StarWars/comments/kop772/anakin_unknowingly_imitates_darth_mauls_enraged/ghtup2l/,1609598037,1,True,False,StarWars,t5_2qi4s,,0,[],,
[],,Empirising,,,[],,,,text,t2_73cj5898,False,False,[],Where at in Pittsburgh??,,,1609598026,{},ghtup1x,False,t3_koswll,False,True,t1_ght77um,/r/StarWars/comments/koswll/i_finally_got_to_see_this_old_star_wars_vending/ghtup1x/,1609598036,1,True,False,StarWars,t5_2qi4s,,0,[],,
[],,GuntherRowe,,,[],,,,text,t2_5f4d3cuu,False,False,[],"I’d love to buy a print, too. When you start selling though, the Disney lawyers enter, unless you’re actually have licensed IP.",,,1609598025,{},ghtuozz,False,t3_kom0nz,False,True,t1_ghs9ele,/r/StarWars/comments/kom0nz/i_like_to_photoshop_old_paintings_this_is_my_sith/ghtuozz/,1609598035,1,True,False,StarWars,t5_2qi4s,,0,[],,
[],,VaultBoy42,,3-10 bigFlair,[],364eda62-77ef-11e9-939b-0e1ee5586816,Lando Calrissian,dark,text,t2_ag7y2,False,False,[],Physics have never been consistent in this work of soft fiction.,,,1609598023,{},ghtuox9,False,t3_kokbqc,False,True,t1_ghtjd87,/r/StarWars/comments/kokbqc/saoirse_ronan_as_a_young_vice_admiral_amilyn_holdo/ghtuox9/,1609598034,1,True,False,StarWars,t5_2qi4s,,0,[],,
[],,IAteAKoala,,,[],,,,text,t2_8bpgu582,False,False,[],I like the blue mandolorian classic helm,,,1609597995,{},ghtunez,False,t3_kood2g,False,True,t3_kood2g,/r/StarWars/comments/kood2g/all_my_helmets_so_farall_of_them_are_made_from/ghtunez/,1609598007,1,True,False,StarWars,t5_2qi4s,,0,[],,
[],,ReProps,,,[],,,,text,t2_836s0l5a,False,True,[],"The Kylo Ren helmet is the only one that was paper mached, the rest have a compilation of plaster, spackle and bondo spotting putty.",,,1609597994,{},ghtunbo,True,t3_kood2g,False,True,t1_ghtqr47,/r/StarWars/comments/kood2g/all_my_helmets_so_farall_of_them_are_made_from/ghtunbo/,1609598005,1,True,False,StarWars,t5_2qi4s,,0,[],,
[],,MotuekaAFC,,,[],,,,text,t2_4255v31n,False,False,[],"The midichlorians are key. Far more important than the force.

Missaa Ja-Ja Binks!",,,1609597991,{},ghtun7l,False,t3_konfuy,False,True,t3_konfuy,/r/StarWars/comments/konfuy/as_much_as_i_love_538_they_dont_seem_to/ghtun7l/,1609598002,1,True,False,StarWars,t5_2qi4s,,0,[],,
[],,AvtarStateIsHydrated,,,[],,,,text,t2_5aye02qs,False,False,[],"Ngl the first season is pretty bad. It gets heaps during the s1 finale. S2 onwards is almost as good as clone wars. Helps that Vader, Maul, Ahsoka, Hondo, and Rex com back..",,,1609597962,{},ghtulq8,True,t3_kox6fm,False,True,t1_ghtugkw,/r/StarWars/comments/kox6fm/in_my_opinion_twilight_of_the_apprentice_was_some/ghtulq8/,1609597973,1,True,False,StarWars,t5_2qi4s,,0,[],,
[],,ReProps,,,[],,,,text,t2_836s0l5a,False,True,[],"That’s what I used for the boba fett helmet in the back and the blue mando helmet, it’s pretty handy stuff for smoothing down the domes.",,,1609597899,{},ghtuidq,True,t3_kood2g,False,True,t1_ghtsoj4,/r/StarWars/comments/kood2g/all_my_helmets_so_farall_of_them_are_made_from/ghtuidq/,1609597911,1,True,False,StarWars,t5_2qi4s,,0,[],,
[],,PinkyandtheStache,,,[],,,,text,t2_kdurw,False,False,[],"Agreed! Everyone says watch it, it’s sooo good. I just can’t get past the “kid” style art.",,,1609597885,{},ghtuhm7,False,t3_kox6fm,False,True,t1_ghtsmha,/r/StarWars/comments/kox6fm/in_my_opinion_twilight_of_the_apprentice_was_some/ghtuhm7/,1609597896,1,True,False,StarWars,t5_2qi4s,,0,[],,
[],,rustystrings1991,,,[],,,,text,t2_7t7yyu40,False,False,[],I tried watching it but it felt too much like a kids show,,,1609597865,{},ghtugkw,False,t3_kox6fm,False,True,t3_kox6fm,/r/StarWars/comments/kox6fm/in_my_opinion_twilight_of_the_apprentice_was_some/ghtugkw/,1609597875,1,True,False,StarWars,t5_2qi4s,,0,[],,
[],,leela_martell,,,[],,,,text,t2_174sk2,False,False,[],"I love all the content bridging the gap between the prequels and the OT, it would certainly bum me out if we couldn't do that re: The Mandalorian and the sequel trilogy.  

I know many people hate the sequels but even more people used to hate the prequels, it's fine. No need to jump in on this multiverse trend because of it. I wouldn't rule it out because it is indeed something all the ""cinematic universes"" suddenly want to do but I personally hate the idea for Star Wars (I actually hate it for the MCU as well but whatever, I don't care about Marvel enough to be actually bothered by it.) Emotional moments like character deaths lose all meaning if those same characters just pop up in the next timeline. Just look at Doctor Who at its worst, was I supposed to care when Rory died for the 84th time? All stakes are gone when nothing is definite and nothing is ever final. Sorry for the partly off-topic rant lol.

As for this ""article"", they refer to Reddit as source.",,,1609597844,{},ghtufhu,False,t3_konq1i,False,True,t3_konq1i,/r/StarWars/comments/konq1i/could_star_wars_have_already_introduced_multiple/ghtufhu/,1609597855,1,True,False,StarWars,t5_2qi4s,,0,[],,
[],,UnXpectedPrequelMeme,,,[],,,,text,t2_nrv1u9n,False,False,[],"Well perhaps the fact that this game aims to evolve the lego game format will be enough to persuade you.  If not, more game for me I suppose.",,,1609597808,{},ghtudms,False,t3_kohtgf,False,True,t1_ghtu9pn,/r/StarWars/comments/kohtgf/time_for_a_new_start/ghtudms/,1609597819,1,True,False,StarWars,t5_2qi4s,,0,[],,
[],,kenny7337,,,[],,,,text,t2_bhatz,False,True,[],Yeah macaroons are rough. How did the texture turn out?,,,1609597782,{},ghtuc7p,False,t3_koy8fy,False,True,t3_koy8fy,/r/StarWars/comments/koy8fy/first_attempt_at_baby_yoda_macarons_and_my_first/ghtuc7p/,1609597792,1,True,False,StarWars,t5_2qi4s,,0,[],,
[],,Tanis8998,,,[],,,,text,t2_56vw3h8r,False,False,[],I wouldn’t mind if he didn’t get so much undeserved love and come to represent everything that Star Wars shouldn’t be.,,,1609597741,{},ghtua49,False,t3_koxpsw,False,True,t1_ghtu747,/r/StarWars/comments/koxpsw/legacy_clones_and_a_true_ending_do_it/ghtua49/,1609597752,1,True,False,StarWars,t5_2qi4s,,0,[],,
[],,ClaryKitty,,,[],,,,text,t2_nd6dj,False,False,[],"Oh I love voice acting in most games, though seeing as the original two Lego Star Wars were some of my favourite games as a kid, the voice acting in the new games just really detracts from the whole experience for me, makes the games feel too samey and similar to other games on the market with no interesting quirks.

Hard to really explain it but I'm legitimately not at all a fan of the fact that they have voice acting now, just can't enjoy the games nearly as much with it.",,,1609597734,{},ghtu9pn,False,t3_kohtgf,False,True,t1_ghtu1q1,/r/StarWars/comments/kohtgf/time_for_a_new_start/ghtu9pn/,1609597745,1,True,False,StarWars,t5_2qi4s,,0,[],,
[],,UnXpectedPrequelMeme,,,[],,,,text,t2_nrv1u9n,False,False,[],Gotta love me some star souls,,,1609597713,{},ghtu8nz,False,t3_kohtgf,False,True,t1_ghtegaj,/r/StarWars/comments/kohtgf/time_for_a_new_start/ghtu8nz/,1609597724,1,True,False,StarWars,t5_2qi4s,,0,[],,
[],,Ragnogroth,,63,[],,,dark,text,t2_k1htv,False,False,[],"Would you ever consider making wallpapers? I have a dual 4K setup and this would be amazing with the baddies on one monitor and the goodies on the other.  
It's not a request though, just a curious question - But all in all super well done!",,,1609597709,{},ghtu8fi,False,t3_kom0nz,False,True,t3_kom0nz,/r/StarWars/comments/kom0nz/i_like_to_photoshop_old_paintings_this_is_my_sith/ghtu8fi/,1609597720,1,True,False,StarWars,t5_2qi4s,,0,[],,
[],,Mighty_thor_confused,,,[],,,,text,t2_t06lv,False,False,[],Woah! Thats  awesome I may have to take that route have to figure out how to use audible first lol. I get random free credits all the time,,,1609597689,{},ghtu7ez,True,t3_kor2iv,False,True,t1_ghttmhe,/r/StarWars/comments/kor2iv/so_im_reading_up_on_asoka_after_the_clone_wars_my/ghtu7ez/,1609597700,1,True,False,StarWars,t5_2qi4s,,0,[],,
[],,UnXpectedPrequelMeme,,,[],,,,text,t2_nrv1u9n,False,False,[],Jedi academy wants to know your location,,,1609597689,{},ghtu7eh,False,t3_kohtgf,False,True,t1_ghsvm0e,/r/StarWars/comments/kohtgf/time_for_a_new_start/ghtu7eh/,1609597699,1,True,False,StarWars,t5_2qi4s,,0,[],,
[],,pjguitar2,,,[],,,,text,t2_1p5ow2l3,False,False,[],Hes terrible and literally a mary sue. Why does no one ever say this,,,1609597684,{},ghtu747,False,t3_koxpsw,False,True,t1_ghtu36x,/r/StarWars/comments/koxpsw/legacy_clones_and_a_true_ending_do_it/ghtu747/,1609597694,1,True,False,StarWars,t5_2qi4s,,0,[],,
[],,[deleted],,,,,,dark,,,,,[],[removed],,,1609597670,{},ghtu6ff,False,t3_kop772,False,True,t1_ghteqef,/r/StarWars/comments/kop772/anakin_unknowingly_imitates_darth_mauls_enraged/ghtu6ff/,1609597680,1,True,False,StarWars,t5_2qi4s,,0,[],,
[],,TheCheechWizardUnit,,,[],,,,text,t2_12q17y,False,True,[],Yummy. They look.,,,1609597633,{},ghtu4i9,False,t3_koy8fy,False,True,t3_koy8fy,/r/StarWars/comments/koy8fy/first_attempt_at_baby_yoda_macarons_and_my_first/ghtu4i9/,1609597643,1,True,False,StarWars,t5_2qi4s,,0,[],,
[],,Tanis8998,,,[],,,,text,t2_56vw3h8r,False,False,[],"Starkiller is a stupid character. There, I said it.",,,1609597608,{},ghtu36x,False,t3_koxpsw,False,True,t3_koxpsw,/r/StarWars/comments/koxpsw/legacy_clones_and_a_true_ending_do_it/ghtu36x/,1609597618,1,True,False,StarWars,t5_2qi4s,,0,[],,
[],,UnXpectedPrequelMeme,,,[],,,,text,t2_nrv1u9n,False,False,[],Voice acting ruining an entire game?  Seems kinda drastic don't you think?,,,1609597580,{},ghtu1q1,False,t3_kohtgf,False,True,t1_ght78bm,/r/StarWars/comments/kohtgf/time_for_a_new_start/ghtu1q1/,1609597591,1,True,False,StarWars,t5_2qi4s,,0,[],,
[],,Travarelli,,,[],,,,text,t2_zu70nby,False,False,[],"&gt; I by no means meant to stir things up.

Eh being honest...you kinda did tho didn't yah?",,,1609597509,{},ghtty45,False,t3_koxsga,False,True,t1_ghtteex,/r/StarWars/comments/koxsga/what_he_said_was_rude_he_doesnt_deserve_to_be/ghtty45/,1609597520,1,True,False,StarWars,t5_2qi4s,,0,[],,
[],,GreyCrowDownTheLane,,,[],,,,text,t2_2f3ktlpt,False,False,[],"Kyp Durron, force-canceling lizards, Vergere, the Yuuzhan Vong, the entirety of *Children of the Jedi *, Traviss’ Highlander romance novel cliches disguised as Mandalorians, Starkiller (way OP and ridiculous), and Joruus C’baoth with Luuuuuuuuke. The more u’s, the more cloned!",,,1609597493,{},ghttx9o,False,t3_kngvvy,False,True,t1_ghl6sta,/r/StarWars/comments/kngvvy/star_wars_alternate_ending_anakin_took_some/ghttx9o/,1609597504,1,True,False,StarWars,t5_2qi4s,,0,[],,
[],,[deleted],,,,,,dark,,,,,[],[removed],,,1609597484,{},ghttws4,False,t3_koy0b9,False,True,t3_koy0b9,/r/StarWars/comments/koy0b9/the_father_vs_scarlet_witch/ghttws4/,1609597494,1,True,False,StarWars,t5_2qi4s,,0,[],,
[],,cvnvr,,,[],,,,text,t2_tbdmq,False,False,[],link to [original artist’s post](https://www.instagram.com/p/CJWH8zVnxn1/?igshid=16jrbsie44dlf) on instagram,,,1609597450,{},ghttv50,False,t3_koq3ea,False,True,t1_ghsnt8m,/r/StarWars/comments/koq3ea/this_is_just_beautiful/ghttv50/,1609597461,1,True,False,StarWars,t5_2qi4s,,0,[],,
[],,steakgames,,3,[],,,dark,text,t2_9qk3u,False,False,[],poetry..that is a good trick,,,1609597366,{},ghttqur,False,t3_kop772,False,True,t3_kop772,/r/StarWars/comments/kop772/anakin_unknowingly_imitates_darth_mauls_enraged/ghttqur/,1609597377,1,True,False,StarWars,t5_2qi4s,,0,[],,
[],,Ein_Schattenwaechter,,4-14 bigFlair,[],1a83f460-77f0-11e9-b00a-0ec1639f6d96,Rose Tico,dark,text,t2_zqy5k3,False,False,[],"What if after one murder the voice that distantly whispered ""murder more"" was now louder? 

The dark side is corruptive, using it makes you want to use it more.",,,1609597321,{},ghttoj9,False,t3_kowb8u,False,True,t1_ghtofc7,/r/StarWars/comments/kowb8u/what_if_you_would_use_the_dark_side_to_do_good/ghttoj9/,1609597331,1,True,False,StarWars,t5_2qi4s,,0,[],,
[],,Thefishtacos,,,[],,,,text,t2_1t9976q2,False,False,[],"I grabbed it on audible a couple months back because I found out it was read by Ashley Eckstein (Ahsoka voice actor),, was pretty decent, not sure if I would READ it, but the audio book was enjoyable. That said I've been really into the star wars audio books this past fall, but the ahsoka one was the first I listened to and got me hooked.",,,1609597280,{},ghttmhe,False,t3_kor2iv,False,False,t1_ghss4as,/r/StarWars/comments/kor2iv/so_im_reading_up_on_asoka_after_the_clone_wars_my/ghttmhe/,1609597291,1,True,False,StarWars,t5_2qi4s,,0,[],,
[],,UnXpectedPrequelMeme,,,[],,,,text,t2_nrv1u9n,False,False,[],And then flip it again when obi fights maul on tattooing.  We see maul try to hit obi in the face like he did to qui gon.  But obi ain't having that shit.,,,1609597238,{},ghttk8f,False,t3_kop772,False,True,t3_kop772,/r/StarWars/comments/kop772/anakin_unknowingly_imitates_darth_mauls_enraged/ghttk8f/,1609597248,1,True,False,StarWars,t5_2qi4s,,0,[],,
[],,Beefytim,,,[],,,,text,t2_1wevyoln,False,False,[],"That would be cool, but it’s Nihilus from KOTOR 2",,,1609597237,{},ghttk6d,False,t3_kom0nz,False,True,t1_ght2x7v,/r/StarWars/comments/kom0nz/i_like_to_photoshop_old_paintings_this_is_my_sith/ghttk6d/,1609597248,1,True,False,StarWars,t5_2qi4s,,0,[],,
[],,GreyCrowDownTheLane,,,[],,,,text,t2_2f3ktlpt,False,False,[],"IIRC, Xixor was referenced/seen in a hologram in *Solo*. He’s canon. That does not mean any details about him from the game/books are canon. It simply means he exists.",,,1609597210,{},ghttirp,False,t3_kngvvy,False,True,t1_ghkzduy,/r/StarWars/comments/kngvvy/star_wars_alternate_ending_anakin_took_some/ghttirp/,1609597221,1,True,False,StarWars,t5_2qi4s,,0,[],,
[],,UnXpectedPrequelMeme,,,[],,,,text,t2_nrv1u9n,False,False,[],"Hmmm.  It does.  But that doesn't account for the chest piece, which does have the heart of beskar so maybe some of the pieces are hand me downs?  But they don't seem like beskar if his helmet can dent a wall, but a space rhino can crush his old set? Maybe durasteel?",,,1609597143,{},ghttfa3,True,t3_koxoo5,False,True,t1_ghtsh2u,/r/StarWars/comments/koxoo5/was_dins_right_thigh_piece_not_beskar/ghttfa3/,1609597154,1,True,False,StarWars,t5_2qi4s,,0,[],,
[],,thelegoroom,,,[],,,,text,t2_1nzjlvp8,False,False,[],Ha - Eddie Izzard is great!,,,1609597135,{},ghttevd,True,t3_koxava,False,True,t1_ghtt5jh,/r/StarWars/comments/koxava/over_christmas_i_made_this_lego_scene_showing/ghttevd/,1609597145,1,True,False,StarWars,t5_2qi4s,,0,[],,
[],,Clobber420,,,[],,,,text,t2_gg5l1,False,False,[],Chesko sebulba,,,1609597133,{},ghttesq,False,t3_koxhev,False,True,t3_koxhev,/r/StarWars/comments/koxhev/another_sebulba_sighting_from_my_building_at_work/ghttesq/,1609597144,1,True,False,StarWars,t5_2qi4s,,0,[],,
[],,GingerArcher,,,[],,,,text,t2_ainfk,False,False,[],"That was the thing that made her origin reveal in IX predictable in my mind.  Whether they had actually planned it or not, they definitely teased it with her natural, untrained fighting style.  She repeatedly used the same jab-at-the-face move as Palpy.",,,1609597131,{},ghtteop,False,t3_kop772,False,True,t1_ghtip26,/r/StarWars/comments/kop772/anakin_unknowingly_imitates_darth_mauls_enraged/ghtteop/,1609597141,1,True,False,StarWars,t5_2qi4s,,0,[],,
[],,DJDMovies,,,[],,,,text,t2_85dmmzjm,False,False,[],"Oh, I thought this was still a hot topic. It seems to be on YouTube. I by no means meant to stir things up.",,,1609597125,{},ghtteex,True,t3_koxsga,False,True,t1_ghttb9d,/r/StarWars/comments/koxsga/what_he_said_was_rude_he_doesnt_deserve_to_be/ghtteex/,1609597136,1,True,False,StarWars,t5_2qi4s,,0,[],,
[],,WatchBat,,2-6 bigFlair,[],76eab074-77ee-11e9-a80e-0ec377e51954,Sith Anakin,dark,text,t2_4uipmj27,False,False,[],"The father is supposed to some kind of a Godly being right? So the Father is stronger imo. Tho I admit my knowledge of Marvel is very limited.

Have you posted this in a marvel sub? You might get different answers there.",,,1609597099,{},ghttd14,False,t3_koy0b9,False,True,t3_koy0b9,/r/StarWars/comments/koy0b9/the_father_vs_scarlet_witch/ghttd14/,1609597110,1,True,False,StarWars,t5_2qi4s,,0,[],,
[],,Travarelli,,,[],,,,text,t2_zu70nby,False,False,[],"I think by wrong you're asking why you're being down voted into oblivion?

It's probably that the subject is just drama from a few days ago and most user/viewers of this sub are past.

You seem to be trying to keep some bullshit going frankly.",,,1609597063,{},ghttb9d,False,t3_koxsga,False,True,t1_ghtt5u0,/r/StarWars/comments/koxsga/what_he_said_was_rude_he_doesnt_deserve_to_be/ghttb9d/,1609597074,1,True,False,StarWars,t5_2qi4s,,0,[],,
[],,DJDMovies,,,[],,,,text,t2_85dmmzjm,False,False,[],If I'm so wrong clearly there is a reason why. Can you tell me why I'm wrong?,,,1609596952,{},ghtt5u0,True,t3_koxsga,False,False,t1_ghtt3rd,/r/StarWars/comments/koxsga/what_he_said_was_rude_he_doesnt_deserve_to_be/ghtt5u0/,1609596963,1,True,False,StarWars,t5_2qi4s,,0,[],,
[],,TabulaRasa99,,,[],,,,text,t2_4rwhlqj6,False,False,[],"Now you need to animate it like this, the best lego I have ever scene",,,1609596946,{},ghtt5jh,False,t3_koxava,False,True,t3_koxava,/r/StarWars/comments/koxava/over_christmas_i_made_this_lego_scene_showing/ghtt5jh/,1609596957,1,True,False,StarWars,t5_2qi4s,,0,[],,
[],,Captain_Obvious_x,,,[],,,,text,t2_hli2u,False,False,[],"Sure, but you're not questioning the mindset of those who expressed interest, you're question the rationale of fans who wish the character didn't exist. The intrigue isn't there for them. 

We have what we have in the character of Holdo. The rest is just a case of ""ifs and buts"".

&gt;  ***I wish Jar-Jar never existed***, but am I going to beat that dead horse endlessly

And that's all the user above said on the matter, but you insisted he elaborate.",,,1609596929,{},ghtt4oh,False,t3_kokbqc,False,True,t1_ghsiw5j,/r/StarWars/comments/kokbqc/saoirse_ronan_as_a_young_vice_admiral_amilyn_holdo/ghtt4oh/,1609596939,1,True,False,StarWars,t5_2qi4s,,0,[],,
[],,Travarelli,,,[],,,,text,t2_zu70nby,False,False,[],"Seems more likely that you are tho as opposed to everyone else.

Right?",,,1609596909,{},ghtt3rd,False,t3_koxsga,False,True,t1_ghtt1p5,/r/StarWars/comments/koxsga/what_he_said_was_rude_he_doesnt_deserve_to_be/ghtt3rd/,1609596920,1,True,False,StarWars,t5_2qi4s,,0,[],,
[],,VaultBoy42,,3-10 bigFlair,[],364eda62-77ef-11e9-939b-0e1ee5586816,Lando Calrissian,dark,text,t2_ag7y2,False,False,[],"That’s the case in both the OT and PT.  Almost all of Anakin’s training takes place between 1 and 2. The bulk of the CW takes place between 2 and 3 and there weren’t plans to show that until years later. 

Luke takes huge strides between 4 and 5 and 5 and 6. 

Criticizing the sequels specifically because a side character was more fleshed out in side media is a bit disingenuous. The franchise has always used other media to flesh out their characters and stories. They do this because they usually leave a fair bit of space between each episode, so the audience is always jumping back in at the middle of a conflict.",,,1609596909,{},ghtt3qw,False,t3_kokbqc,False,True,t1_ghtqbrv,/r/StarWars/comments/kokbqc/saoirse_ronan_as_a_young_vice_admiral_amilyn_holdo/ghtt3qw/,1609596919,1,True,False,StarWars,t5_2qi4s,,0,[],,
[],,BobbyRahm,,,[],,,,text,t2_3r88tnvk,False,False,[],WORTHY!,,,1609596889,{},ghtt2p0,False,t3_kom0nz,False,True,t3_kom0nz,/r/StarWars/comments/kom0nz/i_like_to_photoshop_old_paintings_this_is_my_sith/ghtt2p0/,1609596900,1,True,False,StarWars,t5_2qi4s,,0,[],,
[],,DJDMovies,,,[],,,,text,t2_85dmmzjm,False,False,[],Alot of people can be wrong.,,,1609596869,{},ghtt1p5,True,t3_koxsga,False,True,t1_ghtt0bx,/r/StarWars/comments/koxsga/what_he_said_was_rude_he_doesnt_deserve_to_be/ghtt1p5/,1609596879,1,True,False,StarWars,t5_2qi4s,,0,[],,
[],,Travarelli,,,[],,,,text,t2_zu70nby,False,False,[],"You're used to posting unpopular shit?

Fair enough.",,,1609596841,{},ghtt0bx,False,t3_koxsga,False,True,t1_ghtswtq,/r/StarWars/comments/koxsga/what_he_said_was_rude_he_doesnt_deserve_to_be/ghtt0bx/,1609596851,1,True,False,StarWars,t5_2qi4s,,0,[],,
[],,[deleted],,,,,,dark,,,,,[],[removed],,,1609596840,{},ghtt0ak,False,t3_koxava,False,True,t1_ghtsxih,/r/StarWars/comments/koxava/over_christmas_i_made_this_lego_scene_showing/ghtt0ak/,1609596851,1,True,False,StarWars,t5_2qi4s,,0,[],,
[],,thelegoroom,,,[],,,,text,t2_1nzjlvp8,False,False,[],Thanks 👍,,,1609596838,{},ghtt065,True,t3_koxava,False,True,t1_ghtsgit,/r/StarWars/comments/koxava/over_christmas_i_made_this_lego_scene_showing/ghtt065/,1609596849,1,True,False,StarWars,t5_2qi4s,,0,[],,
[],,thelegoroom,,,[],,,,text,t2_1nzjlvp8,False,False,[],Well I got the start in with the temple March. TBH I couldn’t bring myself to build the Younglings scene!,,,1609596784,{},ghtsxih,True,t3_koxava,False,True,t1_ghtrxxu,/r/StarWars/comments/koxava/over_christmas_i_made_this_lego_scene_showing/ghtsxih/,1609596795,1,True,False,StarWars,t5_2qi4s,,0,[],,
[],,DJDMovies,,,[],,,,text,t2_85dmmzjm,False,False,[],Like I said I'm used to it.,,,1609596770,{},ghtswtq,True,t3_koxsga,False,False,t1_ghtssyu,/r/StarWars/comments/koxsga/what_he_said_was_rude_he_doesnt_deserve_to_be/ghtswtq/,1609596781,1,True,False,StarWars,t5_2qi4s,,0,[],,
[],,lazyazzninja,,,[],,,,text,t2_2he1hu0t,False,False,[],"I already a big picture of Vader on my wall, so I’m thinking Maul for variety.",,,1609596764,{},ghtswjd,False,t3_koxv89,False,True,t1_ghtsi6n,/r/StarWars/comments/koxv89/really_impressed_with_the_sith_lego_art_set_now/ghtswjd/,1609596774,1,True,False,StarWars,t5_2qi4s,,0,[],,
[],,Codus1,,,[],,,,text,t2_1dfcgo2j,False,False,[],"I have always been a little here and there on battle meditation. The way it is depicted in Kotors fleet battle makes it feel all very... video gamey. 

Though I like your description. That it purely keeps the Jedis allied forces inspired. Though, iirc the game kinda adds the feeling that it helps tactically organise everyone etc. (That's the bit I don't like).",,,1609596752,{},ghtsvyg,False,t3_kop772,False,True,t1_ghto84q,/r/StarWars/comments/kop772/anakin_unknowingly_imitates_darth_mauls_enraged/ghtsvyg/,1609596762,1,True,False,StarWars,t5_2qi4s,,0,[],,
[],,Gooseman61oh,,,[],,,,text,t2_zl5v755,False,False,[],Where is jar jar,,,1609596698,{},ghtstes,False,t3_kom0nz,False,True,t3_kom0nz,/r/StarWars/comments/kom0nz/i_like_to_photoshop_old_paintings_this_is_my_sith/ghtstes/,1609596709,1,True,False,StarWars,t5_2qi4s,,0,[],,
[],,Travarelli,,,[],,,,text,t2_zu70nby,False,False,[],"Your post is at 17% and dropping after about 10 minutes.

I guess you have it figured out and everyone else is wrong?",,,1609596689,{},ghtssyu,False,t3_koxsga,False,True,t1_ghtsnri,/r/StarWars/comments/koxsga/what_he_said_was_rude_he_doesnt_deserve_to_be/ghtssyu/,1609596699,1,True,False,StarWars,t5_2qi4s,,0,[],,
[],,mbbedwellart,,,[],,,,text,t2_177ikt,False,False,[],Use to do this a lot in college. Made real looking helmets for fun. If you want them to look smoother you can get lightweight spackling for drywall and sand them down. You can get amazingly smooth curves. If you want I can send some pics so you can see what I mean and if you're interested.,,,1609596600,{},ghtsoj4,False,t3_kood2g,False,True,t1_ghsak32,/r/StarWars/comments/kood2g/all_my_helmets_so_farall_of_them_are_made_from/ghtsoj4/,1609596611,1,True,False,StarWars,t5_2qi4s,,0,[],,
[],,Cursedbythedicegods,,,[],,,,text,t2_bocez,False,True,[],"""Well something's not right, because now I can't see!""",,,1609596586,{},ghtsntr,False,t3_kowthk,False,True,t3_kowthk,/r/StarWars/comments/kowthk/chewie_and_threepio/ghtsntr/,1609596596,1,True,False,StarWars,t5_2qi4s,,0,[],,
[],,DJDMovies,,,[],,,,text,t2_85dmmzjm,False,False,[],I'm used to my opinions being deemed wrong by biligerant people.,,,1609596584,{},ghtsnri,True,t3_koxsga,False,True,t1_ghtsfr2,/r/StarWars/comments/koxsga/what_he_said_was_rude_he_doesnt_deserve_to_be/ghtsnri/,1609596595,1,True,False,StarWars,t5_2qi4s,,0,[],,
[],,SpunkyDred,,,[],,,,text,t2_is3vs,False,False,[],"&gt; apples to oranges

But you can still compare them.",,,1609596578,{},ghtsnfd,False,t3_koy0b9,False,True,t1_ghtslun,/r/StarWars/comments/koy0b9/the_father_vs_scarlet_witch/ghtsnfd/,1609596588,1,True,False,StarWars,t5_2qi4s,,0,[],,
[],,summons72,,,[],,,,text,t2_10k71w,False,False,[],"I know it’s a good show, I just can’t get past the bad artstyle and the toothpick lightsabers. Same with Clone Wars",,,1609596558,{},ghtsmha,False,t3_kox6fm,False,True,t3_kox6fm,/r/StarWars/comments/kox6fm/in_my_opinion_twilight_of_the_apprentice_was_some/ghtsmha/,1609596569,1,True,False,StarWars,t5_2qi4s,,0,[],,
